node,conceptualized_node,node_type
개인정보보호법을 철저히 준수한다.,"compliance, regulation, protection, privacy, security",event
상대방의 동의 없이 계약의 권리와 의무를 양도할 수 없다.,"consent, assignment, contract, obligation, transfer, restriction",event
주식회사 카파벤처스와 주식회사 람다홀딩스가 2025년 1월 1일에 계약을 체결한다.,"agreement, partnership, contract signing, business deal, collaboration",event
효율적인 통지 시스템을 구축한다.,"system improvement, communication, optimization, development, management",event
손해배상액을 상계할 수 있다.,"compensation, offset, deduction, legal remedy, settlement",event
"매도인이 보유한 대상회사 발행 보통주식 12,000,000주를 매수인에게 매도한다.","transaction, transfer, sale, ownership change, stock deal, agreement",event
시너지가 발생한다.,"cooperation, synergy, interaction, collaboration, amplification",event
기간을 연장할 수 있다.,"extension, postponement, delay, flexibility, adjustment",event
요청 정보가 있다.,"request, inquiry, communication, information exchange, seeking",event
양 당사자가 본 계약의 이행에 있어 상호 선의와 신뢰를 바탕으로 성실히 협력한다.,"cooperation, trust, good faith, collaboration, integrity",event
"주당 매매가격을 금 일만원(₩10,000)으로 정한다.","valuation, pricing, agreement, transaction, finance",event
관련 권리가 자동 소멸한다,"termination, expiration, dissolution, cessation, nullification",event
손해가 발생한다.,"loss, damage, disadvantage, setback, misfortune",event
거래종결일이 된다,"completion, closure, finalization, agreement, settlement",event
이 통지만이 유효하다.,"notification, validity, communication, authorization, confirmation",event
기존 브랜드가 존재한다.,"existence, branding, continuity, legacy, identity",event
보상을 청구한다.,"compensation, claim, request, reimbursement, justice",event
매수인이 어떤 사항을 인지한다.,"awareness, realization, recognition, perception, understanding",event
상대방의 동의가 없다,"disagreement, conflict, refusal, dissent, opposition",event
제90조가 규정되었다.,"legislation, regulation, enactment, legal process, codification",event
양 당사자는 본 계약을 이행한다.,"agreement, execution, compliance, partnership, obligation",event
거래가 종결된다.,"completion, closure, agreement, resolution, finalization",event
규제 대응은 매수인 책임이다.,"compliance, responsibility, regulation, accountability, obligation",event
주식회사 람다홀딩스의 대표이사가 2025년 1월 1일에 서명한다.,"signing, authorization, decision-making, leadership, documentation",event
환경이 보호된다.,"conservation, preservation, sustainability, protection, improvement",event
통지 기한은 엄격히 해석된다.,"interpretation, notification, regulation, legal strictness, compliance",event
부채는 매도인에게 귀속된다.,"liability allocation, risk transfer, contract obligation, responsibility assignment",event
제26조(데이터)가 시행된다.,"implementation, enforcement, regulation, governance, compliance",event
일부 조항이 무효가 된다.,"invalidation, legal change, annulment, regulation, amendment",event
주식회사 카파벤처스가 주식회사 뮤테크놀로지에 대한 매도인 역할을 한다.,"business transaction, divestment, intermediary role, corporate action, sale",event
제85조가 시행된다.,"enactment, regulation, implementation, legislation, governance",event
필요한 지적재산권을 보유하고 있다.,"ownership, authorization, protection, compliance, rights",event
각 당사자는 중요한 사항 발생 시 상대방에게 적시에 통지해야 한다.,"notification, communication, obligation, information sharing, responsibility",event
직원을 고용한다.,"recruitment, onboarding, staffing, employment, selection",event
손해배상액을 산정한다.,"compensation, calculation, assessment, liability, evaluation",event
분쟁이 발생한다.,"conflict, confrontation, disagreement, escalation, tension",event
문서를 인도한다.,"transfer, delivery, exchange, transaction, communication",event
본 계약의 조항은 '일반조항'과 '특별조항'으로 구분된다.,"classification, differentiation, regulation, agreement, organization",event
완전한 합의를 구성한다.,"agreement, consensus, negotiation, resolution, settlement",event
매도인은 거래종결일에 매매주식의 완전한 소유권을 매수인에게 이전한다.,"ownership transfer, transaction, agreement, contract fulfillment, asset delivery",event
공개된 것 외 중요 계약이 없다.,"disclosure, transparency, agreement, confirmation, communication",event
공동비용이 발생한다.,"cost sharing, expense, collaboration, distribution, finance",event
기한을 엄수한다.,"punctuality, compliance, responsibility, discipline, commitment",event
"매도인이 대상회사가 발행한 보통주식 12,000,000주를 매수인에게 매도한다.","share transfer, transaction, sale, acquisition, investment, ownership change",event
기한을 엄수한다,"punctuality, compliance, responsibility, discipline, reliability",event
영업일이다,"workday, business, transaction, operation, commerce",event
문서를 작성한다.,"writing, documentation, creation, preparation, composition",event
회사는 추가적인 중요 부채가 존재하지 않는다.,"disclosure, assurance, finance, transparency, risk management",event
준거법이 정해진다.,"rulemaking, legislation, regulation, governance, standardization",event
매도인은 진술과 보증을 한다.,"representation, assurance, disclosure, affirmation, agreement",event
배상 한도가 매매대금의 25%로 제한된다.,"limitation, compensation, restriction, contract, liability",event
핵심 임직원이 계속 근무한다.,"retention, stability, continuity, loyalty, commitment",event
부록이 존재한다.,"addition, supplement, inclusion, extension, attachment",event
"""적시""의 정의가 다른 조항에는 적용되지 않는다.","interpretation, exception, application, legal definition, regulation",event
기존 브랜드를 사용한다.,"brand loyalty, consumption, preference, habit, familiarity",event
제63조가 적용된다.,"regulation, enforcement, compliance, legislation, governance",event
핵심 임직원의 근무 유지를 위해 노력한다.,"retention, loyalty, motivation, management, workforce, engagement",event
행정 사항이 있다.,"notification, announcement, communication, administration, information sharing",event
양 당사자는 본 계약을 체결한다.,"agreement, contract, negotiation, commitment, transaction",event
일부가 무효이다.,"invalidation, nullification, partiality, legal decision, judgment",event
공정하게 해석한다.,"judgment, interpretation, fairness, evaluation, decision-making",event
"하자담보 관련 사항(제29조, 제73조)도 특별조항이다.","contract terms, legal regulation, warranty, liability, agreement",event
라이선스가 발급된다.,"approval, certification, authorization, recognition, validation",event
"서면은 문서, 이메일, 기타 서면 형태를 포함한다.","communication, documentation, recordkeeping, correspondence, information exchange",event
등기 절차가 시작된다.,"legal process, registration, initiation, documentation, procedure",event
매수인은 이메일로 통지를 받을 수 있다.,"notification, communication, permission, agreement, information exchange",event
특별조항은 별도의 통지 규정을 따른다.,"notification, regulation, exception, compliance, agreement",event
본 계약은 해석된다.,"interpretation, agreement, legal process, understanding, clarification",event
연결재무제표에 포함된다.,"inclusion, consolidation, accounting, integration, reporting",event
"매매주식의 총 매매가격을 금 일천이백억원(₩120,000,000,000)으로 정한다.","transaction, pricing, agreement, valuation, contract",event
매매주식의 완전한 소유자가 된다.,"ownership, acquisition, possession, transaction, investment",event
3개월간 지원한다.,"assistance, support, sponsorship, duration, provision",event
해당 사건은 서울중앙지방법원에서 심리된다.,"judicial process, legal proceeding, court hearing, litigation, adjudication",event
법령상 요구 또는 상대방 동의가 있다.,"permission, compliance, consent, authorization, legality",event
양 당사자는 상호 선의와 신뢰를 바탕으로 한다.,"agreement, trust, cooperation, goodwill, collaboration",event
계약이 체결된다.,"agreement, commitment, negotiation, partnership, authorization",event
매수인이 인지한 사항은 진술보증에서 제외된다.,"disclosure, exception, exclusion, acknowledgment, negotiation",event
계약 당사자가 결정된다.,"agreement, determination, selection, designation, resolution",event
매수인이 주주로 인정된다.,"recognition, validation, membership, acquisition, ownership",event
주식이 양도된다.,"transfer, transaction, ownership change, asset movement, investment",event
계좌 정보를 통지한다.,"notification, communication, information sharing, banking, transaction",event
비밀정보 보호 의무에서 예외가 발생한다.,"disclosure, exception, confidentiality, information sharing, legal exemption",event
"""적시""란 별도 정의가 없는 한 3영업일 이내를 의미한다.","deadline, timing, business process, regulation, scheduling",event
문서가 안전하게 저장된다.,"preservation, security, archiving, protection, storage",event
운전자본 등의 변동에 따른 대금조정은 별도 합의에 따른다.,"negotiation, agreement, adjustment, settlement, contract",event
거래종결이 이루어진다.,"agreement, completion, transaction, closure, resolution",event
종결 확인서를 작성한다.,"completion, documentation, verification, closure, confirmation",event
시너지를 위해 협력한다.,"collaboration, partnership, teamwork, unity, synergy, cooperation",event
진술보증 위반에 대한 책임이 발생한다.,"법적책임, 계약위반, 손해배상, 위반행위, 분쟁",event
종결 장소를 정한다.,"decision, selection, agreement, planning, resolution",event
제3장 진술 및 보증이 시작된다.,"contract, agreement, declaration, assurance, commitment",event
계약 당사자가 약속을 한다.,"agreement, commitment, promise, obligation, negotiation",event
진술 및 보증에 대한 내용이 설명된다.,"explanation, clarification, legal discourse, contract interpretation, statement analysis",event
매수인은 거래 후 언제든지 정밀 실사를 수행할 수 있다.,"inspection, verification, due diligence, transaction, evaluation",event
매매대금은 전액 현금으로 지급된다.,"payment, transaction, cash, settlement, agreement",event
시설을 유지한다.,"maintenance, management, operation, upkeep, preservation",event
한국어본이 있다.,"translation, localization, language adaptation, multilingual support, accessibility",event
계약 당사자가 확정된다.,"agreement, confirmation, identification, designation, legal process",event
매매주식은 어떠한 제한도 없는 상태로 양도된다.,"transfer, transaction, ownership change, exchange, agreement",event
부동산 관련 계약은 정상적이다.,"transaction, agreement, legality, validation, compliance",event
2025년 1월 1일에 서명을 한다.,"agreement, commitment, initiation, documentation, ceremony",event
당사자 간에 매매주식의 매매와 관련한 모든 합의가 이루어진다.,"agreement, transaction, negotiation, settlement, contract",event
세무 문제가 발생하지 않았다.,"compliance, legality, safety, stability, avoidance",event
각자가 세금을 부담한다.,"taxation, contribution, fiscal responsibility, duty, payment",event
매매주식의 양도에 제한이 없다.,"transaction, freedom, transfer, trading, regulation",event
조항을 보완한다.,"revision, amendment, improvement, modification, update",event
지적재산권이 필요한 상황이다.,"protection, ownership, authorization, regulation, legal rights",event
특별조항의 범위는 별도로 정한다.,"agreement, limitation, specification, negotiation, clarification",event
거래종결일이 발생한다.,"completion, transaction, closure, finalization, agreement",event
공개된 것 외 중요 부채가 없다.,"disclosure, transparency, assurance, integrity, trust",event
계약의 해석은 대한민국 법률에 근거를 둔다.,"법률해석, 준거법, 계약관계, 해석기준, 법적분쟁",event
규제 대응은 매수인의 책임이다.,"compliance, responsibility, risk management, legal obligation, accountability",event
"매도인, 매수인, 대상회사가 각각 특정된다.","contract, transaction, identification, agreement, parties",event
감사가 회사의 회계 및 업무를 감사한다.,"inspection, evaluation, verification, oversight, review",event
진술보증 관련 사항은 특별조항으로 분류된다.,"classification, legal provision, contract, regulation, categorization",event
권리를 행사하지 않는다.,"abstention, waiver, nonparticipation, inaction, forbearance",event
인지한 사항이 면책된다.,"exemption, recognition, responsibility, liability, awareness",event
진술보증이 정확해야 한다.,"accuracy, verification, responsibility, diligence, compliance",event
"문서, 이메일, 기타 서면 형태로 작성된다","documentation, communication, written form, correspondence, recordkeeping",event
매수인이 감사를 선임한다.,"appointment, selection, governance, oversight, auditing",event
운전자본을 조정한다.,"resource management, financial adjustment, optimization, cash flow, efficiency",event
전환 지원을 3개월간 지원한다.,"support, assistance, aid, transition, adjustment, facilitation",event
전제조건을 포기할 수 있다.,"sacrifice, concession, compromise, flexibility, adaptation",event
진술보증이 위반될 경우 손해를 배상한다.,"compensation, liability, breach, indemnification, responsibility",event
주식 양도가 완료된다,"ownership transfer, transaction, investment, asset redistribution, financial activity",event
대한민국 법률에 따른다.,"regulation, compliance, governance, jurisdiction, legal authority",event
매도인은 거래종결일로부터 3년간 경쟁 사업을 영위하지 않는다.,"restriction, agreement, noncompete, business, prohibition",event
제19조의 적시 정의는 일반조항에만 적용된다.,"interpretation, application, legislation, regulation, legal principle",event
제106조를 공정하게 해석한다.,"interpretation, judgment, fairness, legal analysis, application",event
소송이 제기되지 않았다.,"non-litigation, settlement, agreement, resolution, avoidance",event
요청 정보를 신속히 제공한다.,"information delivery, responsiveness, assistance, support, communication",event
영업비밀을 보호한다.,"protection, confidentiality, safeguarding, secrecy, restriction",event
진술보증 위반에 대한 책임이 2년간 유효하다.,"liability, warranty, contract, duration, obligation",event
서울중앙지방법원이 관할이다.,"jurisdiction, authority, governance, legal process, administration",event
매수인이 이를 매수한다.,"transaction, acquisition, exchange, agreement, ownership transfer",event
"""적시""란 용어가 사용될 때 별도 정의가 없으면 3영업일 이내라는 의미가 적용된다.","interpretation, definition, clarification, timing, standardization, regulation",event
매도인은 다음 사항을 보증한다.,"guarantee, assurance, declaration, obligation, representation",event
대한민국의 은행이 정상 영업한다,"finance, operation, service, business, transaction",event
현재 계약 이행 상태를 유지하고 있다.,"maintenance, compliance, stability, continuation, adherence",event
"매수인이 매도인으로부터 대상회사가 발행한 보통주식 12,000,000주를 매수한다.","acquisition, transaction, investment, share transfer, ownership change, equity purchase",event
매도인에 대한 통지는 등기우편으로 해야 한다.,"legal notice, communication, documentation, procedure, notification",event
모든 정보는 최선을 다해 준비되었다.,"preparation, readiness, completion, organization, assurance",event
대리인이 존재하게 된다.,"representation, delegation, substitution, agency, proxy",event
거래의 완결이 확인된다.,"confirmation, completion, validation, transaction, agreement",event
거래의 법적 주체가 명확해진다.,"clarification, identification, regulation, responsibility, transparency",event
필요 서류를 인도한다.,"delivery, submission, transfer, documentation, exchange",event
청구권이 소멸한다,"expiration, termination, invalidation, cessation, legal event",event
각자 비용을 부담한다.,"cost sharing, independence, responsibility, fairness, division",event
환경 법규를 준수한다.,"regulation, compliance, protection, responsibility, sustainability",event
공개된 것 외에 중요 부채가 존재하지 않는다.,"disclosure, transparency, declaration, assurance, accountability",event
본 계약은 대한민국 법률에 따라 해석된다.,"legal interpretation, jurisdiction, governance, regulation, authority",event
매도인에 대한 통지는 등기우편으로만 유효하다.,"notification, legal procedure, communication, contract enforcement, documentation",event
법규를 준수한다.,"obeying, compliance, regulation, discipline, order",event
제70조,"법률, 조항, 규정, 법조문, 법규, 문서",entity
부채,"채무, 의무, 책임, 부담, 법률용어",entity
제26조,"법률, 조항, 규정, 조문, 기준, 원칙, 조치",entity
주식회사 뮤테크놀로지,"company, corporation, organization, business, entity, firm, enterprise",entity
신속히,"adverb, manner, speed, urgency, action",entity
진술보증 위반에 대한 책임,"책임, 법률, 계약, 분쟁, 의무",entity
법규,"규칙, 제도, 기준, 정책, 조항, 규정, 법령, 체계",entity
법령,"법, 규정, 조항, 기준, 제도, 원칙, 규제",entity
변경 사항,"변경, 변화, 업데이트, 수정, 조정, 알림, 통지",entity
2025년 1월 1일,"날짜, 시점, 기준일, 기념일",entity
상대방 동의,"동의, 허락, 승인, 조건, 필요사항, 합의, 권리",entity
주체,"주체성, 개념, 철학, 원칙, 이념, 사상, 가치",entity
완전한 소유자,"권리자, 소유권자, 투자자, 주주, 당사자",entity
각자,"individual, person, participant, entity, subject",entity
지적재산권,"권리, 법률, 자산, 보호, 제도, 재산",entity
종결 확인서,"문서, 증명서, 확인서, 기록, 서류",entity
구성원,"사람, 집단, 멤버, 인원, 참여자, 일원, 구성체",entity
기업,"조직, 단체, 경제주체, 법인, 기관, 사업체, 경영체",entity
모든 정보,"information, data, content, resource, knowledge",entity
제23조,"법, 조항, 규정, 권리, 조문, 법률",entity
거래종결,"계약, 절차, 과정, 행위, 단계, 완료, 종료",entity
제90조,"법률, 조항, 규정, 조문, 법조문, 문서, 기준",entity
별도의 통지 규정,"규정, 조항, 조건, 조치, 약관, 기준, 법률",entity
제93조,"law, regulation, statute, article, provision, rule",entity
보상,"개념, 제도, 행위, 권리, 절차",entity
서울중앙지방법원,"court, institution, organization, judiciary, authority, tribunal",entity
법령상 요구 또는 상대방 동의 시,"조건, 상황, 예외, 규정, 허가, 동의, 요건",entity
제34조,"법률, 조항, 규정, 규칙, 문서, 조문, 조건",entity
특별조항,"규정, 조항, 조문, 조건, 약관, 법률, 규칙, 원칙",entity
서면,"문서, 기록, 자료, 증거, 정보",entity
청구권,"권리, 법률용어, 청구, 법적개념, 요구",entity
비밀정보 보호의무,"의무, 규정, 원칙, 책임, 법률, 규범, 보호",entity
선임자,"person, representative, agent, participant, actor",entity
계좌 정보,"정보, 데이터, 금융, 기록, 항목, 세부사항",entity
모든 계약,"agreement, contract, document, obligation, commitment, arrangement, legal instrument, transaction",entity
제19조의 적시 정의,"law, regulation, article, definition, provision, clause, legal concept",entity
대상회사,"company, organization, corporation, entity, business, issuer",entity
제46조,"법률, 조항, 규정, 조문, 조치, 기준, 원칙",entity
매매주식의 완전한 소유권,"권리, 소유권, 법적개념, 거래, 재산",entity
제51조,"law, regulation, clause, article, legal provision, rule",entity
주식매도인,"person, participant, seller, party, individual, stakeholder",entity
필요 서류,"document, paperwork, requirement, form, material",entity
모든 거래 과정,"process, transaction, procedure, operation, activity, workflow, system",entity
계약의 일부,"document, agreement, clause, section, attachment, addendum, legal term",entity
환경,"분야, 개념, 조건, 이슈, 주제, 요소, 체계, 시스템, 영향, 문제",entity
제94조,"법률, 조항, 규정, 법조문, 조문, 법령",entity
사회적 책임,"개념, 가치, 의무, 역할, 원칙, 윤리",entity
진술보증 위반 당사자,"당사자, 계약자, 책임자, 법인, 참여자, 주체",entity
주식매수인,"사람, 투자자, 당사자, 참여자, 매수자, 계약자",entity
성실히,"attitude, quality, behavior, value, trait",entity
불가항력,"law, concept, principle, force majeure, exemption, doctrine",entity
경영,"management, administration, operation, leadership, business, organization",entity
문서를 인도한다,"행위, 절차, 과정, 조치, 규정",entity
불이행한 당사자,"participant, party, individual, legal entity, obligor",entity
제7조,"law, regulation, clause, article, rule, provision, policy",entity
감사,"직원, 임원, 직위, 역할, 감독, 관리, 조직",entity
수신자,"person, participant, receiver, individual, entity, role",entity
자금,"금융, 자산, 재원, 수단, 자원, 경제",entity
납부자,"사람, 개인, 주체, 납세자, 참여자",entity
노동법규,"법, 규정, 기준, 원칙, 제도, 규율",entity
이사,"직원, 관리자, 임원, 조직원, 인사",entity
매수인이 인지한 사항,"information, knowledge, awareness, fact, disclosure, condition",entity
적시,"time, period, deadline, duration, term, interval",entity
중요 계약,"agreement, contract, document, arrangement, record, obligation",entity
"보통주식 12,000,000주","stock, share, security, equity, asset, unit",entity
대리인,"사람, 대표, 역할, 대행, 대리, 중개인, 관계자",entity
책임,"의무, 부담, 역할, 개념, 원칙, 규정",entity
비밀정보,"정보, 데이터, 자산, 내용, 기록, 자료, 요소",entity
운영,"management, administration, operation, process, activity, function",entity
이전 주체,"participant, party, entity, stakeholder, predecessor",entity
적절한 보험,"보장, 안전, 제도, 서비스, 정책, 재정관리",entity
어떠한 제한도 없는 상태,"condition, state, freedom, openness, possibility",entity
신속한 의사소통,"communication, interaction, efficiency, process, system, function",entity
제83조,"law, regulation, rule, article, statute, legal provision",entity
규제 대응,"정책, 관리, 의무, 대응, 절차",entity
관련 법규,"법, 규정, 규칙, 기준, 조항, 정책, 제도",entity
고용,"노동, 일자리, 채용, 인력, 근로, 직업, 경제",entity
단순 주식 양도 방식,"transaction, method, process, procedure, strategy, approach, system",entity
기한,"기간, 시간, 제한, 마감, 조건, 규정",entity
수령인,"person, recipient, individual, party, agent",entity
"일만원(₩10,000)","currency, money, denomination, value, amount, unit",entity
서명,"문서, 인증, 행위, 절차, 증거, 기록",entity
거래종결 후의 사항,"procedure, regulation, provision, process, guideline",entity
다음 사항,"항목, 조건, 조항, 내용, 사항, 규정",entity
상호 선의와 신뢰,"attitude, principle, relationship, foundation, trust, cooperation",entity
제25조,"조항, 규정, 법률, 조문, 기준, 원칙",entity
특별조항의 범위,"범위, 조건, 조항, 규정, 기준, 내용, 한계",entity
공동비용,"비용, 지출, 분담, 항목, 재정, 회계",entity
관련 법규 준수,"규정, 기준, 원칙, 의무, 조건, 규제, 조항",entity
투명하고 공정하게,"principle, value, standard, guideline, ethic",entity
본 계약,"agreement, contract, document, legal instrument, transaction, regulation",entity
별도 합의,"agreement, contract, arrangement, negotiation, consensus, legal term",entity
경쟁 사업,"business, industry, market, enterprise, activity, field",entity
정밀 실사,"조사, 평가, 절차, 분석, 활동, 과정",entity
기존 배당,"배당, 권리, 이익, 분배, 금융, 자산",entity
3영업일 이내,"기간, 시간, 기한, 조건",entity
매도인,"사람, 역할, 주체, 거래자, 당사자, 참여자",entity
적시의 정의,"legal concept, interpretation, principle, regulation, doctrine",entity
매매대금,"금액, 자금, 비용, 거래, 자산, 가치",entity
거래종결일,"날짜, 시점, 마감일, 기한, 종료, 기준일, 거래",entity
운전자본 등의 변동,"capital, finance, resource, agreement, transaction, operation",entity
