node,conceptualized_node,node_type
제106조,"law, clause, regulation, article, statute, provision, rule",entity
각 당사자,"party, participant, entity, individual, stakeholder",entity
통지의 구체적 방법,"절차, 규정, 방식, 기준, 조치, 행위, 원칙, 방법",entity
본 계약의 조항,"조항, 조건, 내용, 규정, 문서, 약관",entity
대한민국,"country, nation, state, region, society",entity
직원,"사람, 인력, 인원, 구성원, 근로자, 인재, 인적자원",entity
"대상회사 발행 보통주식 12,000,000주","stock, shares, equity, security, asset, instrument",entity
일부 조항,"clause, provision, rule, regulation, article, term",entity
다른 주체,"subject, stakeholder, participant, agent, party",entity
서면 합의,"계약, 문서, 약정, 합의서, 기록, 절차",entity
일반조항,"clause, provision, article, section, term, regulation, rule",entity
별도,"조건, 규정, 항목, 범위, 조항",entity
대금조정,"contract, agreement, negotiation, settlement, transaction, adjustment",entity
제1장,"section, chapter, part, division, unit, document",entity
공급망,"network, system, logistics, infrastructure, distribution, management",entity
매도인 지정 계좌,"계좌, 금융상품, 금융계정, 거래수단, 자산",entity
매매주식의 매매와 관련한 당사자 간의 모든 합의,"계약, 합의, 약정, 문서, 법률관계, 협약, 거래",entity
지적재산권 보유 주체,"소유자, 권리자, 단체, 기관, 주체, 조직, 당사자",entity
문서,"텍스트, 기록, 자료, 파일, 정보, 자료형태, 내용",entity
종결,"event, conclusion, ending, occurrence, process",entity
브랜드,"category, identity, trademark, concept, value, reputation, symbol",entity
매도인에 대한 통지,"절차, 요건, 통지, 문서, 법률",entity
대표이사,"position, executive, leader, representative, officer, authority",entity
기타 서면 형태,"문서, 기록, 매체, 자료, 형태",entity
손해배상,"법률, 제도, 보상, 청구, 책임, 권리, 의무",entity
조항,"규정, 내용, 조건, 조문, 기준, 원칙, 요소, 항목",entity
공정하게,"adverb, manner, principle, value",entity
매수인에 대한 통지,"document, notice, communication, message, notification",entity
청구권 소멸,"법률, 권리, 소멸, 절차, 사건, 법적 개념",entity
매매대금의 25%,"비율, 제한, 조건, 기준",entity
한국어본,"language, version, text, translation, document",entity
제공 주체,"provider, entity, participant, organization, agent",entity
규제,"제도, 정책, 제한, 통제, 관리, 법률",entity
정확성,"특성, 품질, 상태, 가치, 기준",entity
대한민국 법률,"법, 규정, 기준, 제도, 규율, 체계, 기준문서",entity
주당 매매가격,"price, value, amount, cost, figure, metric",entity
특별조항 관련 통지,"문서, 통지, 서류, 통보, 행정절차, 법률사항",entity
진술보증 위반 관련 통지,"통지, 문서, 알림, 법률문서, 계약, 조항, 의무, 조건",entity
특별한 사정,"condition, circumstance, situation, exception, reason",entity
시너지,"협력, 효과, 상호작용, 상승, 관계, 동기, 영향",entity
주식,"자산, 금융상품, 투자수단, 증권, 소유권",entity
거래 과정,"과정, 절차, 시스템, 활동, 메커니즘, 행위, 단계",entity
사항,"내용, 정보, 항목, 요소, 조건, 주제",entity
없음,"개념, 상태, 조건, 상황, 요소, 존재",entity
적시 통지,"의무, 원칙, 규정, 조건, 통보, 정책, 절차",entity
제공 정보,"정보, 데이터, 내용, 사실, 자료",entity
기존 브랜드,"브랜드, 이름, 정체성, 마케팅, 상표",entity
균분,"method, principle, allocation, distribution, rule",entity
경영권,"권리, 지위, 통제, 소유, 지배, 책임, 구조, 시스템",entity
제5장,"chapter, section, part, article, provision",entity
매매주식,"자산, 금융상품, 투자수단, 거래대상, 소유권, 증권",entity
추가 조정 없음,"조치, 결정, 규정, 상태, 행위, 상황",entity
"일천이백억원(₩120,000,000,000)","금액, 자본, 가치, 재산, 투자, 비용, 자산, 예산, 수치",entity
지적재산권 보유,"법률, 권리, 제도, 보호, 규정",entity
거래종결 후,"time, stage, process, event, transaction phase, period",entity
제95조,"law, regulation, article, statute, rule, provision, legal code",entity
통지,"notice, notification, communication, document, information, message",entity
이전,"transaction, transfer, change, event, occurrence",entity
제96조,"law, regulation, article, rule, provision",entity
대금,"payment, money, funds, transaction, amount, value",entity
배상 한도,"limit, restriction, condition, policy, regulation, percentage, clause, rule",entity
최선을 다해,"effort, dedication, commitment, perseverance, attitude",entity
통지자,"person, participant, notifier, agent, role",entity
권리 포기,"행위, 선택, 결정, 법률 용어, 상태, 절차",entity
보험,"제도, 서비스, 금융상품, 보장, 계약, 안전망",entity
관련 권리 자동 소멸,"법률, 규정, 원칙, 절차, 제도",entity
권리 불행사,"법률, 개념, 권한, 상태, 행위",entity
수령자,"사람, 대상, 개인, 참가자, 수취인",entity
손해 배상,"법률, 책임, 보상, 계약, 손실, 청구",entity
영업비밀,"정보, 자산, 권리, 비밀, 재산, 보호 대상",entity
제3장 진술 및 보증,"section, chapter, clause, provision, statement, warranty, document, legal term",entity
제104조,"law, regulation, statute, article, provision, rule, policy",entity
권리의무,"법률관계, 법적개념, 의무, 권리, 법원칙",entity
통지 기한,"기간, 조건, 제한, 규정, 조항, 시간",entity
인지한 사항,"fact, information, knowledge, awareness, issue, circumstance",entity
행정,"system, management, governance, operation, process, authority, administration",entity
제5장 거래종결 후 사항,"chapter, section, regulation, provision, document, rule",entity
제86조,"law, regulation, article, provision, statute, rule",entity
상대방,"person, party, counterpart, participant, entity",entity
제99조,"law, article, clause, provision, regulation, rule, section",entity
계좌,"금융, 자산, 정보, 기록, 관리, 서비스",entity
통지를 불이행한 당사자,"party, individual, participant, stakeholder, entity, subject",entity
다른 언어본,"version, edition, translation, language option, alternative",entity
우호적 해결,"agreement, resolution, settlement, solution, negotiation, approach, method",entity
이행 주체,"주체, 당사자, 역할, 참여자, 법적주체",entity
등기우편,"우편, 서비스, 통신, 전달, 시스템, 방식, 절차",entity
이메일,"통신, 메시지, 정보, 수단, 기술",entity
매도 및 매수,"거래, 계약, 행위, 과정, 절차, 활동",entity
손해배상액,"금액, 손해, 보상, 책임, 법률, 배상",entity
부록,"section, supplement, attachment, addition, document, component, annex",entity
기간을 연장할 수 있다,"option, extension, permission, policy, rule, exception",entity
제75조,"law, regulation, article, provision, rule",entity
전제조건,"조건, 기준, 요소, 요건, 필요조건, 필수사항",entity
권리,"자격, 자율성, 법률, 특권, 이익, 책임",entity
양 당사자,"party, participant, counterpart, entity, stakeholder",entity
진술보증,"계약, 법률, 보증, 약속, 조항, 조건, 책임, 의무",entity
배상,"보상, 책임, 법률, 손해, 금전, 규정",entity
관련 조항,"법률, 규정, 조문, 조항, 기준, 원칙",entity
제67조,"법, 조항, 규정, 규칙, 조문, 조례",entity
데이터,"information, value, asset, resource, record, element, input",entity
관련 권리 행사 불가,"restriction, limitation, condition, legal term, policy",entity
상태,"condition, situation, phase, stage, status, state",entity
지명 이사,"position, role, officer, title, authority",entity
통지 시스템,"시스템, 기술, 도구, 플랫폼, 프로세스, 방법",entity
요청 정보,"data, information, content, resource, input",entity
통지 불이행,"의무, 책임, 제한, 조건, 결과",entity
세금,"비용, 재정, 의무, 부담, 경제, 정책",entity
서울,"city, capital, location, place, region, metropolis",entity
거래종결 이후 발생하는 사항,"조건, 사안, 절차, 사항, 조치, 과정, 단계",entity
본 계약과 관련하여,"계약, 문서, 조항, 조건, 약정, 사항, 내용",entity
대한민국의 은행이 정상 영업하는 날,"날, 일, 일정, 근무일, 영업일, 시간, 기간, 개념",entity
주식회사 카파벤처스,"company, corporation, business, organization, entity",entity
전환 지원,"assistance, support, transition, aid, service, program",entity
청구인,"person, claimant, participant, applicant, individual",entity
하자담보 관련 사항,"조항, 규정, 조건, 계약, 법률, 항목",entity
거래종결일로부터 2년간,"기간, 시간, 기한, 유효기간, 조건, 약정, 법률용어",entity
계약,"문서, 약정, 법률, 거래, 합의, 절차, 관계, 약속, 조건",entity
부동산 관련 계약,"contract, agreement, document, transaction, arrangement, legal instrument",entity
합리적 가정,"추론, 전제, 논리, 기준, 조건",entity
제37조,"law, regulation, article, legal provision, rule, statute",entity
수정,"변경, 조정, 행위, 과정, 절차, 합의",entity
필요시,"condition, requirement, necessity, circumstance, provision",entity
통상의 영업과정,"operation, business process, management, activity, procedure, transaction, workflow",entity
시설,"장소, 공간, 기관, 조직, 설비, 구조, 시스템",entity
환경 법규,"규정, 법률, 정책, 기준, 규범, 제도, 원칙",entity
계약일로부터 30일 내,"period, deadline, duration, timeframe, term",entity
제51조에 따라 주식 양도가 완료되는 날,"date, day, event, deadline, milestone, timeline",entity
자산,"재무, 가치, 소유, 자원, 항목, 경제",entity
진술보증 위반,"위반, 책임, 법률, 계약, 조항, 조건, 분쟁, 리스크",entity
모든 라이선스,"license, permission, authorization, certification, regulation, policy",entity
노동,"노동, 일, 활동, 직업, 근로, 행위, 과정, 생산",entity
나머지 조항,"clause, provision, term, section, article",entity
예측,"행위, 과정, 사고, 판단, 분석, 추론",entity
공개 정보,"정보, 데이터, 자료, 공개, 자산, 문서",entity
계약 당사자,"사람, 당사자, 참여자, 주체, 법적 주체, 계약자",entity
모든 권리,"right, entitlement, ownership, authority, legal term, privilege",entity
거래종결일로부터 3년간,"period, duration, term, timeframe, restriction, condition",entity
제64조,"법률, 조항, 규정, 조문, 문서, 규칙",entity
주식회사 람다홀딩스,"company, corporation, business, organization, entity",entity
개인정보보호법,"law, regulation, legislation, policy, rule, statute",entity
매수인,"사람, 구매자, 주체, 당사자, 거래자, 참여자",entity
은행,"기관, 금융, 조직, 서비스, 산업, 사업체",entity
일부,"부분, 요소, 구성, 집합, 단위, 항목",entity
이전 상대방,"person, predecessor, participant, stakeholder, entity",entity
거래 비용,"비용, 경제학, 지출, 개념, 개입, 요소",entity
핵심 임직원,"구성원, 직원, 인재, 인력, 인사, 인원, 조직",entity
주주명부,"명부, 기록, 문서, 등록, 자료, 증서",entity
본 거래,"transaction, exchange, agreement, process, event",entity
분쟁,"상황, 문제, 갈등, 사건, 이슈, 사안, 관계",entity
제85조,"law, regulation, article, provision, clause, rule",entity
운전자본,"자본, 금융, 회계, 재무, 자산, 관리",entity
영업일,"날, 기간, 일정, 시간, 근무일, 업무일, 평일, 은행일",entity
완전한 합의,"합의, 결정, 절차, 과정, 원칙, 상태",entity
연구개발,"활동, 과정, 혁신, 기술, 창조, 발전, 전략, 과학, 관리",entity
진술보증 관련 사항,"계약, 조항, 조건, 법률, 약정, 규정",entity
총칙,"chapter, section, regulation, provision, law, rule, guideline, framework",entity
개인정보보호법 준수,"법률, 규정, 조항, 정책, 준칙, 기준, 원칙, 지침",entity
등기,"등록, 절차, 법률, 문서, 행위, 시스템, 기록",entity
재무제표,"자료, 보고서, 문서, 기록, 정보, 데이터",entity
적극적 지원,"행동, 도움, 지원, 협력, 참여",entity
불이행,"행위, 상태, 법률개념, 책임, 위반, 결과",entity
손해를 입은 당사자,"사람, 피해자, 주체, 개인, 당사자, 관계자",entity
당사자,"participant, party, individual, stakeholder, entity, actor",entity
연결재무제표,"회계, 재무, 보고서, 문서, 자료, 정보, 기준, 시스템",entity
인도자,"person, participant, leader, agent, role, individual",entity
채무,"법률, 금융, 의무, 책임, 계약, 관계, 권리",entity
완전한 권한,"권리, 소유권, 지위, 상태, 법적 개념",entity
나머지,"부분, 부분집합, 일부, 잔여, 여분, 개념",entity
제42조,"article, clause, provision, regulation, rule, legal term",entity
연결,"relationship, association, link, connection, integration, combination",entity
제59조,"law, article, regulation, clause, provision, legal document",entity
노력한다,"effort, action, perseverance, intent, motivation",entity
효율적인 통지 시스템,"시스템, 메커니즘, 방법, 인프라, 프로세스, 소통, 도구",entity
중재,"절차, 방법, 제도, 해결, 과정, 시스템",entity
중요 부채,"채무, 의무, 책임, 재정, 위험, 약점",entity
작성된다,"creation, composition, generation, documentation, formulation",relation
책임이 있다,"의무, 담당, 소속, 의존, 부담",relation
경쟁 사업을 영위하지 않는다,"non-competition, exclusivity, restriction, prohibition, business separation",relation
인지하다,"realize, become aware, recognize, perceive, notice",relation
보완된다,"improve, enhance, supplement, reinforce, strengthen",relation
포함된다,"포함, 소속, 속하다, 일원, 내포",relation
선임될 수 있다,"be appointed, be selected, be eligible, be nominated, be chosen",relation
준거법으로 삼는다,"refer to, base on, use as standard, apply as rule, rely on",relation
양도할 수 없다,"nontransferable, inalienable, unassignable, nondelegable",relation
발생하면 즉시 통지한다,"immediate notification, real-time alert, instant reporting, prompt communication, immediate response",relation
납부되었다,"paid, settled, processed, completed, fulfilled",relation
근무를 유지하도록,"continue employment, retain position, maintain work, sustain job",relation
기재된다,"record, document, state, enter, note",relation
유지되고 있다,"continue, persist, remain, last, endure",relation
의미한다,"signify, represent, indicate, denote, express, stand for",relation
규정하다,"define, set rules, specify, determine, prescribe",relation
준비되었다,"be ready, be prepared, be set, be equipped, be organized",relation
양도된다,"transfer, hand over, assign, pass on, convey",relation
송금된다,"transfer, remit, send funds, move money, wire",relation
준수하다,"follow, comply, obey, adhere, conform",relation
체결한다,"make agreement, establish contract, formalize deal, sign pact, conclude arrangement",relation
이후,"after, following, subsequent to, next, succession",relation
필요하다,"require, demand, necessitate, call for, depend on",relation
매도하다,"sell, dispose of, transfer ownership, relinquish, trade",relation
이행되고 있다,"progressing, being carried out, proceeding, underway, being implemented",relation
전액 현금으로 지급된다,"full payment, cash transaction, monetary settlement",relation
다한다,"fulfill, accomplish, complete, carry out, perform",relation
유지된다,"지속, 보존, 상태유지, 계속됨, 존속",relation
기초한다,"base on, rely on, depend on, be founded on, be supported by",relation
부담한다,"take responsibility, bear cost, assume obligation, shoulder duty",relation
따른다,"follow, obey, comply, adhere, conform",relation
정보를 제공한다,"communicate, disclose, share, inform, convey",relation
고용이 승계된다,"employment transfer, job succession, workforce continuity, labor inheritance, staff transition",relation
소유하다,"possess, have, own, control, hold",relation
불이행 시,"failure event, breach, noncompliance, default, violation",relation
is participated by,"be engaged by, be attended by, be joined by, be involved by, be taken part by",relation
실패 시,"if unsuccessful, on failure, when not achieved, upon failing",relation
대상회사이다,"be subject to, be target of, be chosen entity, be selected company",relation
지명하다,"appoint, designate, assign, select, nominate",relation
감사를 선임한다,"appoint auditor, select overseer, assign inspector, designate reviewer",relation
확보하다,"gain, secure, obtain, acquire, ensure",relation
관련되다,"연관성, 관계, 연결, 연계, 상관성",relation
연구개발을 계속한다,"sustain innovation, pursue advancement, maintain progress, continue improvement, ongoing development",relation
구분된다,"differentiate, distinguish, separate, classify, identify",relation
제한된다,"confined, bounded, constrained, restricted",relation
엄격히 해석된다,"strict interpretation, narrow reading, precise definition, limited understanding, literal analysis",relation
이루어진다,"consist of, be formed by, be made up of, be composed of, comprise",relation
있으면,"existence, presence, availability, possession, being",relation
정확해야 한다,"be precise, be accurate, ensure correctness, maintain exactness, uphold fidelity",relation
우선한다,"take precedence, come before, be prioritized, override, have priority",relation
포기될 수 있다,"abandonment, relinquishment, withdrawal, surrender, give up",relation
정한다,"determine, decide, designate, assign, establish",relation
보호한다,"지킨다, 방어한다, 안전하게 한다, 지지한다, 유지한다",relation
매수인이다,"buy, acquire, obtain, receive, purchase",relation
제공된다,"공급, 지원, 전달, 배분, 분배",relation
이전된다,"이동, 전달, 변환, 전이, 전송",relation
양호한 상태이다,"be well, be healthy, be stable, be in good condition, be sound",relation
등기에 협력한다,"assist registration, support documentation, facilitate process, contribute action, help completion",relation
이전에,"earlier than, prior to, before, preceding",relation
일어난다,"발생하다, 생기다, 일어나다, 일시적 상태, 변화",relation
구축하다,"build, establish, create, form, set up, develop",relation
때문에,"cause, reason, due to, result of, basis for",relation
구성한다,"form, make up, build, compose, constitute, create",relation
귀속된다,"belong to, assigned to, attributed to, affiliated with, associated with",relation
이행한다,"carry out, perform, execute, fulfill, accomplish",relation
대표이사가 서명한다,"authorize, endorse, approve, validate, confirm",relation
해결에 협력한다,"assist, collaborate, contribute, support, work together",relation
노동법규를 준수한다,"follow rules, obey regulations, comply with standards, adhere to guidelines",relation
진술하고 보증한다,"assert, declare, warrant, affirm, guarantee",relation
공개된 것 외에 중요 부채가 없다,"financial disclosure, transparency, liability status, debt declaration",relation
제반 사항을 규정하다,"set rules, define conditions, establish guidelines, specify requirements, outline provisions",relation
무효여도,"invalidity, nullification, ineffectiveness, unenforceability",relation
의미하지 않는다,"exclude, not signify, lack meaning, not represent, have no implication",relation
협력한다,"work together, collaborate, cooperate, join forces, partner",relation
지급한다,"provide, give, allocate, distribute, offer",relation
가지고 있다,"own, possess, contain, hold, have",relation
매도인이다,"sell, transfer ownership, assign rights, provide goods",relation
적용된다,"적용성, 관여, 영향, 반영, 해당",relation
상계할 수 있다,"offset, counterbalance, compensate, neutralize, adjust",relation
매수하다,"acquire, purchase, obtain, secure, invest in",relation
총 매매가격은,"price, value, amount, cost, sum",relation
이전한다,"move, relocate, transfer, change location, shift",relation
공개된 것 외에는 존재하지 않다,"limited existence, disclosed only, not present otherwise, exclusive to public, restricted presence",relation
진행된다,"take place, occur, happen, be conducted, unfold",relation
초래한다,"cause, lead to, bring about, result in, generate",relation
요구한다,"request, need, necessitate, call for, demand",relation
유효하려면 필요하다,"requirement, prerequisite, necessary condition, dependency, qualification",relation
사용한다,"utilize, employ, make use of, apply, exploit",relation
청구된다,"요구된다, 부과된다, 징수된다, 요청된다",relation
해석된다,"be understood as, be interpreted as, be regarded as, be considered as, be seen as",relation
보유한다,"possess, have, own, retain, hold",relation
위반될 경우,"breach, violation, noncompliance, infraction, contravention",relation
포함한다,"contain, encompass, consist of, comprise, incorporate",relation
결과로,"lead to, result from, outcome of, consequence of, produce",relation
적용하다,"implement, utilize, put into practice, employ, use",relation
이다,"be, exist as, represent, serve as, function as",relation
보장하다,"확실히 하다, 책임지다, 담보하다, 보호하다, 지키다",relation
취득된다,"obtain, acquire, receive, gain, secure",relation
경영을 지원한다,"assist management, support operations, facilitate leadership, aid administration",relation
장소가,"location, place, setting, site, area, venue",relation
발생하면,"trigger, result, occur, happen, initiate, arise",relation
이전,"transfer, move, shift, handover, transition",relation
금액은,"monetary value, amount, sum, price, cost",relation
수행할 수 있다,"가능하다, 실행, 역량, 성취, 달성",relation
조정된다,"change, adapt, regulate, modify, control, adjust",relation
유효하다,"be valid, hold true, apply, be effective, be in force",relation
중요한 사항 발생 시 통지한다,"notify, inform, alert, communicate, report",relation
관할이다,"govern, oversee, supervise, manage, administer",relation
보유하다,"possess, own, have, hold, retain",relation
반드시 필요하다,"requirement, necessity, essential, indispensability, obligation",relation
균분된다,"divide, split, distribute, allocate, share",relation
제외된다,"leave out, omit, exclude, remove, eliminate",relation
한도를 가진다,"limit, restrict, set boundary, cap, constrain",relation
가능하다,"be possible, can do, be achievable, be feasible, have potential",relation
일자가 된다,"become one, unify, merge, integrate, combine",relation
준비되어야 한다,"be arranged, be set up, be provided, be organized, be equipped",relation
인도된다,"guide, lead, direct, bring, escort",relation
사항에 협력한다,"work together, collaborate, assist, support, coordinate",relation
분류된다,"categorize, classify, group, sort, assign",relation
동시에,"at the same time, simultaneous, concurrent, synchrony",relation
규정한다,"define, establish rules, prescribe, determine, set out",relation
