node,conceptualized_node,node_type
양 당사자는 본 계약의 체결 및 이행에 있어 상호 선의와 신뢰를 바탕으로 성실히 협력한다,"agreement, cooperation, trust, commitment, partnership",event
검증 비용은 하자가 확인된 경우 매도인이 부담한다,"liability, cost allocation, defect verification, seller responsibility, contractual obligation",event
모든 손해배상 청구는 하자의 구체적 내용을 기술한 상세 보고서를 첨부해야 한다,"legal claim, compensation, damage report, documentation, liability",event
대한민국의 은행이 정상 영업한다,"banking, operation, finance, business, commerce",event
검증 기관은 양 당사자가 합의하여 선정한다,"agreement, selection, verification, consensus, cooperation",event
각 당사자는 필요시 대리인을 선임할 수 있다.,"representation, delegation, authorization, agency, substitution",event
통상 15영업일이 소요된다,"processing, duration, timeline, waiting period, business days",event
검증 절차가 진행된다,"verification, validation, testing, evaluation, inspection",event
거래 관련 공동 비용은 균등하게 분담된다,"cost sharing, transaction, fairness, cooperation, expense distribution",event
양 당사자는 선량한 관리자의 주의의무로 본 계약을 이행한다,"contract, obligation, duty, agreement, legal responsibility",event
거래종결과 동시에 매수인이 지명한 자를 대상회사의 이사로 선임한다,"appointment, corporate governance, transaction, board member, succession",event
사업 운영이 가능하다.,"business, operation, management, entrepreneurship, commerce",event
매수인은 필요시 외부 전문가를 선임하여 실사를 수행할 수 있다,"due diligence, expert consultation, investigation, assessment, verification",event
모든 정보가 중요한 측면에서 정확하고 완전하다,"accuracy, completeness, information quality, data integrity, reliability",event
매매대금은 거래종결일에 전액 현금으로 지급된다,"payment, transaction, settlement, cash, finance",event
각 당사자는 본 거래와 관련하여 발생한 자신의 비용을 부담한다,"cost allocation, expense sharing, financial responsibility, transaction settlement, mutual agreement",event
각 당사자가 진술보증 사항에 중요한 변경이 발생할 경우 즉시 상대방에게 통지한다,"notification, communication, obligation, update, responsibility",event
천재지변 등 불가항력적 사유가 발생한다,"natural disaster, force majeure, calamity, unforeseen event, emergency",event
하자는 독립된 제3자 전문기관의 검증을 거쳐야 한다,"verification, validation, third-party, inspection, certification",event
매수인은 하자를 발견한 날로부터 14일 이내에 매도인에게 서면으로 통지해야 한다,"notification, deadline, contract, obligation, communication",event
제89조에 정한 증빙자료를 첨부해야 한다,"documentation, evidence, compliance, verification, recordkeeping",event
본 계약에 따른 모든 통지는 등기우편 또는 이메일로 한다,"communication, notification, correspondence, contract, delivery",event
검증 비용을 매도인이 부담한다,"cost burden, verification, seller responsibility, transaction, expense allocation",event
모든 손해배상 청구는 하자와 손해 간 인과관계 입증 자료를 첨부해야 한다,"legal claim, compensation, causation, evidence, liability",event
대상회사의 경영이 독립적으로 유지된다,"management, autonomy, independence, governance, self-direction",event
통지에는 하자의 구체적 내용과 예상 손해액이 포함된다,"notification, defect, damage estimation, communication, legal process",event
일방이 정당한 사유 없이 거래종결을 거부할 경우,"contract dispute, breach, refusal, legal issue, transaction failure",event
기존 공급계약은 동일한 조건으로 유지된다,"contract, agreement, maintenance, consistency, business",event
매도인은 처분권한을 가진다,"authorization, ownership, disposal rights, legal authority, property transfer",event
매도인은 거래종결 후 3개월간 월별로 재무 정보를 업데이트하여 제공한다,"reporting, financial update, post-transaction, information sharing, compliance",event
매도인은 대상회사 관련 정보를 신속히 제공한다,"information sharing, disclosure, transaction, communication, business process",event
"매매주식이 담보권, 제한, 부담이 없는 상태로 양도된다","transfer, ownership, unencumbered, securities, transaction",event
본 계약의 효력 발생을 위해 아래와 같이 서명한다,"contract, agreement, signing, authorization, validation",event
매수인은 확정된 손해배상액을 상계할 수 있다,"legal settlement, compensation, offset, financial claim, contract law",event
대상회사의 모든 중요 자산이 양호한 상태로 유지되고 있다,"asset management, maintenance, stability, preservation, condition monitoring",event
거래종결 후 60일 내에 운전자본을 확정한다,"financial closing, working capital, transaction finalization, accounting, business process",event
대상회사의 핵심 임직원은 거래종결 후 최소 1년간 근무를 유지한다,"employment, retention, commitment, workforce, contract",event
매도인이 제3자에게 더 유리한 조건을 제시한다,"negotiation, offer, transaction, advantage, bargaining",event
각 당사자는 즉시 상대방에게 통지한다,"notification, communication, obligation, responsibility, alert",event
재무제표가 중요한 측면에서 정확하다,"accuracy, finance, reporting, precision, validation",event
검증 비용은 하자가 확인되지 않은 경우 매수인이 부담한다,"cost responsibility, verification, buyer obligation, defect inspection, contractual terms",event
매도인은 본 계약 체결일 현재 다음 사항이 진실하고 정확함을 진술하고 보증한다,"warranty, representation, contract, assurance, legal statement",event
"주식의 상태는 주식에 담보권, 제한, 부담이 없어야 한다","securities, collateral-free, restrictions, financial status, legal condition",event
거래 상대방은 최신 재무 정보를 받을 수 있다,"information exchange, finance, communication, data update, business",event
본 계약은 2부를 작성한다,"contract, agreement, documentation, legal process, formalization",event
본 계약 체결일이 있다,"agreement, contract, signing, commitment, legal act",event
매도인의 진술보증 위반에 대한 하자담보책임은 거래종결일로부터 60일간 유효하다,"warranty, liability, legal responsibility, contract, dispute resolution",event
대상회사의 모든 중요 문서는 거래종결 후 매수인에게 인도된다,"transaction, delivery, documentation, transfer, agreement",event
매도인의 거래종결 의무가 발생한다,"obligation, contract, transaction, duty, completion",event
각 당사자는 진술보증 사항에 중요한 변경이 발생한다,"contract, update, warranty, obligation, notification",event
매매대금이 준비된다,"payment, transaction, preparation, finance, settlement",event
매수인은 매매대금 지급에 필요한 충분한 자금을 확보했음을 확인한다,"verification, finance, transaction, payment, confirmation",event
배당이 거래종결 전에 선언되었다,"dividend, declaration, finance, transaction, announcement",event
목표액과 차이를 정산한다,"settlement, adjustment, reconciliation, finance, accounting",event
제50조는 예측 정보에 대해 설명한다,"law, regulation, information, prediction, guideline",event
상대방의 사전 서면 동의가 필요하다,"consent, agreement, permission, authorization, approval",event
재무제표에 대상회사의 부채와 우발채무가 기재되어 있다,"financial statement, liabilities, contingent liabilities, accounting, reporting",event
매수인이 실사 과정에서 실제로 인지한 사항이 있다,"due diligence, awareness, inspection, recognition, transaction",event
거래종결 후 발견된 부채는 매도인에게 귀속된다,"debt, liability, transaction, seller, obligation",event
2025년 1월 1일 매도인과 매수인이 서명한다,"contract, agreement, signing, transaction, legal process",event
제92조에 정한 바,"law, regulation, article, legal provision, statute",event
일방이 권리를 포기한 것으로 보지 않는다.,"legal decision, rights waiver, contract interpretation, dispute resolution, law analysis",event
모든 진술과 보증은 거래종결일을 기준으로 한다,"agreement, assurance, transaction, closing, guarantee",event
대상회사는 모든 세금을 적시에 신고·납부했다,"tax compliance, timely payment, financial responsibility, legal adherence, fiscal management",event
매수인의 거래종결 의무가 발생한다,"obligation, contract, transaction, legal duty, completion",event
대상회사는 노동 관련 법규를 준수한다,"compliance, labor law, regulation, adherence, legal conformity",event
양 당사자가 검증 기관 선정에 합의하지 못한다,"disagreement, negotiation, conflict, decision-making, verification process",event
매수인은 매매대금 지급을 한다,"payment, transaction, purchase, settlement, finance",event
거래종결이 이루어졌다,"transaction, agreement, deal, closure, negotiation",event
거래종결일이 도래한다,"deadline, transaction, closure, settlement, finalization",event
계약 이행 시 선관주의의무를 다한다,"contractual duty, good faith, obligation, legal responsibility, compliance",event
거래와 관련된 양도소득세는 매도인이 부담한다,"taxation, capital gains, transaction, seller responsibility, financial obligation",event
거래종결 후 6개월 내에 매수인은 매도인에게 경영 자문을 요청할 수 있다,"consultation, advisory, post-transaction, management, agreement",event
일방이 정당한 사유 없이 거래종결을 거부한다,"contract dispute, breach, refusal, negotiation failure, conflict",event
대상회사는 사업 운영에 필요한 모든 지적재산권을 적법하게 사용할 권리를 가진다,"intellectual property, legal rights, business operation, licensing, authorization",event
본 계약의 수정이나 변경은 양 당사자의 서면 합의에 의해서만 가능하다.,"contract modification, agreement, negotiation, legal process, consent",event
"운전자본, 순부채 등의 변동에 따른 매매대금 조정은 제92조에 정한 바에 따른다","financial adjustment, transaction, regulation, accounting, contract",event
본 계약은 대한민국 법률에 따라 규율된다,"contract, law, regulation, agreement, jurisdiction",event
손해배상 청구는 제89조에 정한 증빙자료를 첨부하여 서면으로 해야 한다,"legal claim, compensation, documentation, procedural requirement, litigation",event
모든 통지는 등기우편 또는 이메일로 이루어진다,"communication, notification, correspondence, delivery, formal notice",event
매도인은 거래종결 5영업일 전까지 매매대금 수령 계좌 정보를 통지한다,"notification, transaction, payment, deadline, communication",event
검증 절차는 복잡한 사안의 경우 30영업일까지 연장될 수 있다,"verification, procedure, extension, complexity, deadline",event
검증 절차가 30영업일까지 연장될 수 있다,"extension, verification, delay, procedure, process",event
공개된 위험에 대해서는 매도인이 책임지지 않는다,"liability, disclosure, risk, seller responsibility, contract law",event
향후 규제 변경에 따른 비용이 매수인에게 부담된다,"regulation, cost burden, buyer responsibility, financial impact, policy change",event
매수인이 하자를 발견한 날로부터 14일 이내에 서면으로 통지하지 않은 경우,"notification, deadline, contract, legal obligation, communication",event
매도인의 진술보증이 중요한 측면에서 정확할 것,"warranty, accuracy, statement, assurance, legal compliance",event
불이행이 발생한다,"noncompliance, breach, violation, default, infraction",event
데이터룸을 통해 모든 정보가 공개되었다,"disclosure, transparency, information sharing, data access, openness",event
상대방은 계약을 해제하고 손해배상을 청구할 수 있다,"contract termination, compensation claim, legal dispute, contract law, damages",event
주식회사 알파벤처스가 주식회사 베타홀딩스와 2025년 1월 1일에 계약을 체결했다,"contract, agreement, business deal, partnership, corporate transaction",event
매도인은 매수인의 추가 실사 요청에 성실히 협조해야 한다,"cooperation, diligence, transaction, due diligence, compliance",event
대상회사는 사업과 관련된 모든 법령과 규정을 중요한 측면에서 준수하고 있다,"compliance, regulation, adherence, legal conformity, governance",event
매매대금 조정은 제92조에 정한 바에 따른다.,"contract adjustment, legal provision, transaction regulation, financial settlement, statutory compliance",event
미지급된 배당이 매도인에게 귀속된다.,"dividend, ownership, finance, transaction, entitlement",event
분쟁을 대한민국 법률에 따라 해석한다,"legal interpretation, dispute resolution, law application, jurisdiction, legal analysis",event
그 권리를 포기한 것으로 보지 않는다,"rights, waiver, legal, renunciation, entitlement",event
거래종결 후 첫 회계연도의 감사보고서는 작성된다,"auditing, financial reporting, post-transaction, compliance, accounting",event
본 계약은 한국어로 작성된다,"contract, agreement, documentation, language, legal",event
거래종결 즉시 대상회사는 주주명부에 매수인을 기재한다,"transaction, registration, ownership, shareholding, corporate procedure",event
일방이 권리를 행사하지 않았다.,"inaction, forbearance, passivity, restraint, nonexercise",event
계약의 해석에 대한 분쟁이 발생한다,"dispute, conflict, interpretation, contract, legal issue",event
매도인이 거래종결 5영업일 전까지 매매대금 수령 계좌 정보를 통지한다,"notification, payment, transaction, deadline, communication",event
대상회사는 전 직원에게 경영권 변경을 통지한다,"notification, management change, corporate communication, employee update, organizational shift",event
당사자들이 우호적 해결을 우선으로 한다,"negotiation, mediation, conflict resolution, agreement, cooperation",event
매매대금이 준비될 것,"transaction, payment, preparation, finance, commerce",event
주식회사 알파벤처스 대표이사가 계약서에 서명했다,"contract signing, business agreement, executive action, corporate deal, formalization",event
대상회사는 주주명부에 매수인을 기재한다,"registration, shareholder, transaction, recordkeeping, documentation",event
상대방이 계약을 해제한다,"cancellation, termination, contract, agreement, dissolution",event
책임을 면한다,"exemption, absolution, immunity, relief, acquittal",event
지급은 매도인이 지정한 계좌로 송금하는 방식으로 한다,"payment, transaction, remittance, banking, finance",event
각 당사자는 자신을 위한 거래종결 전제조건을 포기할 수 있다.,"agreement, waiver, negotiation, contract, legal process",event
검증 기관이 선정된다,"selection, verification, authorization, appointment, evaluation",event
대상회사의 모든 중요 자산이 정상적으로 운영되고 있다,"operation, asset management, stability, business continuity, monitoring",event
거래종결일 기준 운전자본을 확정한다,"financial closing, working capital, transaction finalization, accounting, business process",event
거래종결이 서울특별시 강남구 소재 매도인의 사무실에서 이루어졌다,"transaction, deal, agreement, business, negotiation",event
대상회사가 사용하는 모든 부동산의 임대차계약은 정상적이며 유효하다,"contract validity, real estate, leasing, legal compliance, property management",event
계약 상대방으로부터 위반 통지를 받은 바 없다,"contract, compliance, notification, legal status, agreement",event
법령상 요구되거나 상대방의 서면 동의가 있는 경우,"legal requirement, consent, agreement, documentation, compliance",event
매수인이 합리적으로 요청하는 대상회사 관련 정보를 요청한다,"information request, due diligence, negotiation, data exchange, business communication",event
대상회사의 핵심 임직원이 거래종결 후 최소 1년간 근무를 유지하도록 최선의 노력을 다한다,"employee retention, commitment, post-transaction, workforce stability, dedication",event
당사자들이 거래종결 날짜에 합의한다,"agreement, negotiation, deal, contract, settlement",event
대상회사는 개인정보보호법 등 데이터 보호 관련 법규를 완전히 준수한다,"compliance, data protection, privacy, regulation, legal adherence",event
매수인은 거래종결일로부터 30영업일 이내에 대상회사에 대한 확인실사를 수행한다,"due diligence, inspection, verification, transaction, business process",event
거래종결 후 첫 회계연도의 감사보고서는 매수인이 선임한 감사인이 작성한다,"audit, financial reporting, post-transaction, corporate governance, compliance",event
매수인은 거래종결 전 언제든지 추가 실사를 요청할 수 있다,"due diligence, inspection, verification, transaction, contractual right",event
주당 매매가격은 금 일만원으로 정해졌다,"pricing, transaction, valuation, market, finance",event
매수인은 매도인에게 서면으로 통지해야 한다,"notification, communication, legal process, written notice, obligation",event
취득세는 거래와 관련하여 매수인이 부담한다,"taxation, transaction, buyer, liability, financial obligation",event
실사 과정에서 공개된 것 외에 연간 1억원 이상의 중요 계약은 없다,"contract, finance, business, disclosure, agreement",event
매도인은 주요 고객과의 관계를 원만히 유지하도록 적극 협조한다,"cooperation, relationship, customer service, collaboration, communication",event
본 계약은 당사자 간 완전한 합의를 구성한다,"agreement, contract, consensus, negotiation, legal understanding",event
매도인이 기존 분쟁 해결을 위해 필요한 정보를 제공한다,"information sharing, dispute resolution, cooperation, negotiation, communication",event
소유권 관련 사항에 대한 하자담보책임은 무기한 유효하다,"legal responsibility, ownership, warranty, liability, contract law",event
매도인에게 경영 자문,"consultation, advisory, service, business support",entity
임대차계약,"contract, agreement, lease, legal document, transaction",entity
"금 일만원(₩10,000)","currency, money, price, value, denomination, financial unit",entity
공소시효 만료일,"deadline, statute, limitation, expiration, legal term",entity
책임과 비용 부담,"responsibility, cost, burden, obligation, expense",entity
노동조합,"organization, group, association, collective, labor union",entity
대상회사의 모든 중요 문서,"document, file, record, paperwork, data",entity
예측 정보,"information, data, prediction, forecast, insight",entity
매매대금 수령 계좌 정보,"account, financial information, payment details, banking data, transaction record",entity
요청,"request, demand, application, petition, inquiry",entity
기존 공급계약,"contract, agreement, supply, transaction, legal arrangement",entity
종결 전제조건,"조건, 전제, 요건, 필요사항, 필수요소",entity
주식회사 감마테크,"company, corporation, business, organization, enterprise",entity
본 계약에 정한 절차,"procedure, process, agreement, contract, obligation",entity
하자담보책임 청구,"legal claim, contractual obligation, liability, lawsuit, legal process",entity
추가 자료,"document, evidence, information, data, material",entity
증빙자료,"document, evidence, proof, record, file",entity
경영권 변경,"management change, corporate control, ownership transfer, business restructuring, governance shift",entity
추가 대가 지급 등의 조정 없음,"contract term, agreement condition, payment clause, legal provision",entity
모든 정보,"information, data, knowledge, content, facts",entity
"금 일천억원(₩100,000,000,000)","money, currency, amount, value, finance, capital",entity
필요 서류,"document, paperwork, record, file, certificate, form",entity
서면,"document, writing, contract, statement, claim",entity
어느 당사자,"party, participant, entity, stakeholder, individual",entity
소유권 이전,"ownership transfer, legal process, property rights, transaction, contract",entity
거래,"transaction, trade, deal, exchange, commerce",entity
거래종결 후 60일 내,"기간, 기한, 일정, 시간프레임",entity
진술과 보증,"statement, warranty, legal term, contract clause",entity
기존 분쟁 해결,"conflict resolution, dispute settlement, negotiation, mediation, agreement, problem solving",entity
필요시,"necessity, condition, requirement, contingency, circumstance",entity
모든 중요 자산,"asset, property, resource, capital, possession",entity
매매대금 지급에 필요한 충분한 자금 확보,"funding, finance, liquidity, capital, resources, assurance",entity
매매대금 지급에 필요한 충분한 자금,"funds, capital, liquidity, financial resources, payment capability",entity
대리인,"agent, representative, proxy, delegate, intermediary",entity
손해액 산정 근거,"document, evidence, report, proof, data, information",entity
거래 시너지 실현,"collaboration, cooperation, partnership, synergy, alliance",entity
시설 이전,"relocation, transfer, movement, logistics, operation",entity
절차,"process, method, procedure, protocol, system",entity
어느 일방에게 유리하게,"bias, partiality, favoritism, inequality, unfairness",entity
총 매매가격,"price, value, cost, amount, sum",entity
지급,"payment, transaction, remittance, financial process, money transfer",entity
영업,"business, operation, sales, commerce, trade",entity
제공한 모든 정보의 정확성을 위해 최선을 다했음,"statement, assurance, confirmation, declaration",entity
매매주식의 매매와 관련한 당사자 간의 모든 합의,"agreement, contract, negotiation, deal, transaction",entity
책임,"duty, obligation, responsibility, accountability",entity
제92조,"law, article, clause, regulation, statute",entity
정당한 사유 없이,"reason, cause, justification, excuse, explanation",entity
하자의 구체적 내용,"defect, flaw, issue, problem, fault, imperfection",entity
하자담보책임,"legal liability, warranty, contractual obligation, seller responsibility, defect liability",entity
주식회사 알파벤처스,"company, corporation, business, enterprise, firm, organization",entity
매도인 추가 자료 요구,"request, demand, requirement, transaction, communication",entity
부담,"liability, obligation, encumbrance, burden",entity
진술보증 사항,"legal term, contract clause, assurance, warranty",entity
대상회사의 중요한 부채,"debt, liability, financial obligation, accounting item, creditor claim",entity
외부 전문가,"expert, consultant, specialist, professional, advisor",entity
나머지 조항,"clause, provision, condition, article, term, regulation",entity
데이터룸,"data room, information system, platform, digital space, virtual environment",entity
번역본,"translation, version, text, document",entity
중요한 측면에서 완전성,"completeness, wholeness, integrity, totality",entity
일부 조항,"clause, provision, article, term, condition, legal element",entity
계약 상대방,"party, counterparty, agreement participant, contractual entity",entity
1부,"part, section, portion, segment, division",entity
모든 중요 자산의 양호한 상태,"asset condition, maintenance, status, management",entity
진술보증 위반,"legal issue, contract breach, warranty violation, liability",entity
감사보고서,"report, document, audit, financial statement, evaluation",entity
중요한 측면,"aspect, factor, element, consideration, perspective",entity
본 계약의 부록,"contract, appendix, document, agreement, clause",entity
주식,"stock, equity, investment, asset, security",entity
진술보증,"warranty, assurance, guarantee, contractual term, legal provision",entity
모든 재무 정보,"financial data, accounting information, financial statements, fiscal records",entity
2025년 1월 1일,"date, day, time, event",entity
통제권,"control, authority, power, management, governance",entity
거래종결일,"date, deadline, closing day, settlement date, transaction completion",entity
본 계약 체결일로부터 30일 이내,"timeframe, period, deadline, duration, interval",entity
모든 중요 문서,"document, record, file, paperwork, archive, dossier",entity
예상 손해액,"손해, 금액, 예상, 손실, 피해, 비용, 평가",entity
비용,"expense, charge, cost, payment, expenditure, fee",entity
매수인의 진술보증이 정확함,"warranty, assurance, guarantee, condition",entity
변경,"change, modification, alteration, adjustment, transformation",entity
거래종결 후 발견된 자산,"asset, property, resource, possession",entity
