node,conceptualized_node,node_type
거래종결 의무 발생 조건,"condition, requirement, obligation, legal term, contract clause",entity
매도인 진술보증,"warranty, guarantee, assurance, obligation, legal term, contract condition",entity
기존 분쟁 해결을 위한 필요한 정보,"정보, 데이터, 자료, 지식",entity
허가,"permission, authorization, license, approval, consent",entity
종결 확인서,"document, certificate, confirmation, agreement, record",entity
주요 고객,"customer, client, buyer, stakeholder, partner",entity
제89조에 정한 증빙자료,"document, evidence, proof, record, attachment",entity
발견된 자산,"asset, property, resource, possession, ownership",entity
제공된 사업계획 및 예측,"document, report, plan, forecast, data, information",entity
매도인에게 귀속됨,"legal term, contractual condition, financial status, transaction clause",entity
법령,"law, regulation, statute, legislation, legal framework, rule",entity
중요한 측면에서 정확함,"accuracy, precision, correctness, reliability, exactness",entity
환경 관련 분쟁,"dispute, conflict, litigation, issue, controversy, case",entity
한국채택국제회계기준,"accounting standard, financial regulation, reporting framework, accounting principle",entity
분쟁,"conflict, dispute, disagreement, controversy, confrontation, issue",entity
대금조정,"조정, 거래, 금융, 매매, 가격조정, 경제",entity
당사자들이 합의한 날,"agreement date, settlement day, contract completion, negotiation milestone, closing time",entity
진술보증 사항에 중요한 변경,"statement, assurance, change, declaration",entity
재무상태,"financial condition, economic status, fiscal health, accounting state, monetary situation",entity
필요한 정부 승인,"approval, authorization, permit, consent, clearance, sanction",entity
경영 자문,"consulting, advisory, management, service, guidance",entity
목표액과 차이,"finance, accounting, calculation, financial metric, business term",entity
매매대금이 준비됨,"condition, obligation, transaction, contract",entity
매도인의 진술보증,"warranty, guarantee, assurance, legal term, contract clause",entity
거래종결 전제조건,"조건, 전제, 조항, 요구사항, 기준",entity
이전의 모든 구두 또는 서면 합의,"agreement, contract, understanding, settlement, arrangement",entity
자신의 비용,"costs, expenses, charges, fees, payments",entity
통지 내용,"notification, message, communication, announcement, information, alert",entity
중요 계약,"contract, agreement, deal, legal document, negotiation",entity
통지 기한을 도과한 청구,"legal claim, deadline, notification, legal term, procedural rule",entity
상세 보고서,"report, document, record, analysis, summary",entity
주요 고객과의 관계 유지,"고객관리, 관계유지, 협력, 비즈니스, 소통, 거래관리",entity
거래종결 후 발생하는 행정적 사항,"administration, procedure, cooperation, compliance, regulation",entity
본 계약의 일부 조항,"contract clause, legal provision, agreement term, contractual condition",entity
중재,"mediation, arbitration, negotiation, dispute resolution, conflict management",entity
매도인,"seller, party, owner, trader, participant, stakeholder",entity
계약의 해석에 대한 분쟁,"dispute, conflict, legal issue, contract law, controversy",entity
예측,"prediction, forecast, estimation, projection, anticipation",entity
거래종결,"transaction closure, contract completion, deal finalization, agreement settlement",entity
우발채무,"debt, liability, obligation, financial risk, contingent liability",entity
확인실사,"inspection, verification, due diligence, audit, review",entity
노동조합과의 단체협약,"agreement, contract, negotiation, labor relations, workplace policy",entity
하자나 문제점,"issue, problem, defect, challenge, difficulty",entity
감사인,"auditor, inspector, examiner, reviewer, accountant",entity
당사자 간 완전한 합의,"agreement, contract, consensus, understanding, settlement",entity
행정절차,"procedure, process, administration, regulation, policy, governance",entity
본 계약 체결일 및 거래종결일 현재 다음 사항이 진실하고 정확함,"contract, agreement, legal document, declaration, statement",entity
합리적인 가정,"assumption, premise, hypothesis, condition, presumption",entity
거래종결일 기준 운전자본,"financial term, accounting, working capital, liquidity, finance",entity
더 유리한 조건,"condition, term, agreement, clause, provision",entity
검증 절차 소요 기간,"기간, 시간, 프로세스, 절차, 검증",entity
매도인의 진술보증 위반에 대한 하자담보책임,"liability, warranty, legal responsibility, contractual obligation, defect claim",entity
조정,"mediation, negotiation, adjustment, arbitration, reconciliation",entity
제50조,"law, article, regulation, clause, statute",entity
사회공헌 활동,"corporate social responsibility, philanthropy, community service, social impact, nonprofit activity",entity
전액 현금,"payment, transaction, finance, money, cash",entity
사업과 관련된 모든 규정,"규정, 법률, 정책, 규칙, 지침, 관리체계",entity
상대방의 서면 동의,"consent, agreement, approval, authorization, permission",entity
핵심 임직원,"employee, staff, personnel, key personnel, executive, workforce",entity
거래종결일까지,"deadline, end date, cutoff, final day",entity
이전의 모든 서면 합의,"agreement, contract, understanding, settlement, arrangement",entity
매매,"transaction, trade, agreement, contract",entity
월별,"time, period, frequency, interval",entity
경영권,"control, management rights, authority, governance, leadership",entity
청구,"claim, demand, request, legal action, obligation",entity
매매대금 조정,"transaction adjustment, payment modification, financial settlement",entity
제63조에 따른 제3자 검증 보고서,"report, document, verification, evidence, record",entity
통상의 영업과정,"business process, operation, commercial activity, routine management",entity
서면 동의,"consent, agreement, approval, authorization, permission, endorsement",entity
대한민국의 은행이 정상 영업하는 날,"business day, working day, banking day, operational day, weekday",entity
본 거래,"transaction, agreement, deal, contract, arrangement",entity
당사자들,"participants, parties, individuals, stakeholders",entity
검증 기관 선정,"selection, designation, appointment, decision",entity
제50조 (예측 정보),"law, article, regulation, clause, legal provision",entity
대상회사의 모든 보험계약,"insurance contracts, agreements, policies, coverage, financial arrangements, risk management",entity
세무,"tax, taxation, financial obligation, fiscal policy, government revenue",entity
부동산,"property, real estate, asset, land, building",entity
일방,"party, participant, entity, actor, stakeholder",entity
제1심 관할법원,"court, jurisdiction, legal institution, tribunal, judiciary",entity
3영업일,"time period, business days, duration, interval",entity
적절한 보상한도,"보상한도, 보험한도, 보험계약, 한도, 보상액, 계약조건",entity
추가 실사 요청,"request, inquiry, procedure, process, obligation",entity
번역본과 불일치 시,"conflict, discrepancy, priority, translation, language rule",entity
"보통주식 10,000,000주","stock, share, equity, asset, security",entity
증빙,"evidence, documentation, proof, verification, record",entity
서울특별시 강남구,"district, region, administrative area, locality, neighborhood",entity
부록,"appendix, supplement, addendum, attachment, document section",entity
불가항력적 사유,"force majeure, uncontrollable event, legal excuse, unavoidable circumstance, exemption reason",entity
어느 일방,"party, participant, entity, individual, stakeholder",entity
등기우편,"mail, postal service, communication, delivery method, correspondence",entity
"매도인이 보유한 대상회사 발행 보통주식 10,000,000주를 매수인에게 매도","contract, agreement, transaction, sale, purchase",entity
본 계약상 권리의무를 제3자에게,"contract, obligation, right, legal term, agreement, clause",entity
유효하다,"validity, status, condition, legal state",entity
각 당사자,"participant, party, entity, stakeholder, individual",entity
매수인이 인지하고 있던 사항,"knowledge, awareness, information, understanding, cognition",entity
관련 등기 절차,"procedure, process, cooperation, legal action, transaction",entity
본 계약과 관련된 분쟁,"dispute, conflict, litigation, legal matter, controversy, disagreement",entity
실사,"inspection, audit, evaluation, review",entity
거래종결 후,"time, period, stage, phase",entity
문제점,"issue, problem, defect, flaw, concern",entity
데이터 보호 관련 법규,"law, regulation, compliance, privacy, policy",entity
한국어본,"language, translation, text, document, version",entity
목표액,"target amount, goal, objective, financial metric",entity
목표 달성,"goal, objective, achievement, target",entity
라이선스,"permission, authorization, certification, approval, legal right",entity
중요한 계약,"contract, agreement, deal, arrangement, commitment",entity
"담보권, 제한, 부담이 없는 상태","security interest, lien, encumbrance, claim, legal right",entity
본 계약 체결일,"date, contract date, agreement date, legal term",entity
모든 기한,"deadline, timeframe, schedule, due date, time limit",entity
기존 브랜드,"brand, trademark, identity, label, company",entity
대한민국의 은행,"bank, financial institution, company, organization, business",entity
주주명부,"document, record, register, ledger, list",entity
거래 관련 공동 비용,"cost, expense, fee, charge, expenditure",entity
손해액 산정 근거 및 관련 증빙,"document, evidence, proof, claim, compensation",entity
환경 관련 소송,"lawsuit, legal case, dispute, litigation, environmental issue",entity
제한,"restriction, limitation, constraint, boundary, regulation",entity
매수인이 선임한 감사인,"auditor, inspector, reviewer, examiner, inspectorate, auditor role",entity
성실하게,"diligence, sincerity, conscientiousness, dedication, earnestness",entity
불이행,"breach, nonperformance, default, liability, obligation",entity
매매대금,"transaction amount, payment, financial term, trading value, monetary exchange",entity
제51조,"law, article, regulation, clause, statute",entity
운전자본 확정,"finance, accounting, capital, liquidity, funds",entity
검증 비용,"비용, 비용 부담, 검증 절차, 경제적 부담, 지출",entity
중요한 부정적 변동,"사건, 변화, 영향, 리스크, 문제, 손실",entity
진행 중인 세무조사,"investigation, audit, inquiry, legal process, examination",entity
"₩100,000,000,000","currency, amount, money, value, sum, capital",entity
매수인이 실사 과정에서 실제로 인지한 사항,"knowledge, awareness, information, fact, insight",entity
미지급 매매대금,"debt, payment, liability, financial obligation",entity
연간 1억원 이상의 중요 계약,"contract, agreement, business deal, financial commitment",entity
대한상사중재원,"arbitration institution, dispute resolution, legal organization, mediation center",entity
매도인의 사무실,"office, workplace, location, business place, property",entity
환경 관련 소송이나 분쟁,"lawsuit, dispute, conflict, legal case, environmental issue",entity
첫 회계연도,"accounting period, financial year, fiscal year, reporting period",entity
이전의 모든 구두 합의,"agreement, contract, understanding, arrangement, negotiation",entity
본 계약,"contract, agreement, deal, legal document, commitment",entity
대상회사 관련 정보,"company, business, organization, entity",entity
전 직원,"employee, staff, personnel, workforce, team",entity
보상한도,"limit, cap, threshold, maximum, boundary",entity
매매주식의 총 매매가격,"price, value, cost, amount, total",entity
운전자본,"working capital, finance, asset, liquidity",entity
주식회사 베타홀딩스,"company, corporation, business, enterprise, firm",entity
손해배상 청구,"legal claim, compensation, liability, damages, lawsuit",entity
거래종결 후 6개월 내,"기간, 시간, 기한, 시기, 기간조건",entity
제63조,"law, article, regulation, clause, legal provision",entity
단체협약,"agreement, contract, negotiation, labor relations, collective bargaining",entity
추가 대가 지급,"payment, compensation, adjustment, transaction, financial term",entity
재무 정보,"financial data, economic information, accounting records, fiscal details, monetary statistics",entity
통지 시점,"time, moment, point, instance, occasion",entity
이사회 결의서,"document, resolution, agreement, decision, record",entity
거래종결 후 60일,"period, duration, timeframe, deadline, interval",entity
손해배상 책임 한도,"liability limit, compensation cap, legal responsibility, financial obligation, indemnity ceiling",entity
거래종결 후 3개월간,"기간, 시간, 일정, 기간한정",entity
거래종결일로부터 3년간 대상회사와 경쟁하는 사업,"business, agreement, contract, obligation, restriction",entity
양 당사자가 협의하여,"agreement, negotiation, arrangement, understanding, contract",entity
거래종결 5영업일 전,"time frame, notification period, business days, deadline, transaction phase",entity
제51조에 따라 주식 양도가 완료되는 날,"date, deadline, settlement day, transaction completion",entity
매매주식,"stock, equity, asset, security, share",entity
본 계약을 체결하고 이행할 완전한 권한과 능력,"authority, power, capacity, legal right, competence",entity
향후 규제 변경,"regulation, policy, law, governance, compliance, rule, legislation",entity
중요한 측면에서 정확성,"accuracy, precision, correctness, exactness",entity
일관된 회계 기준,"accounting principle, standard, guideline, financial regulation, policy",entity
30영업일,"duration, period, timeframe, working days, deadline",entity
제3자 검증 보고서,"report, verification, documentation, assessment, evidence",entity
사업계획,"plan, proposal, strategy, project, outline, forecast",entity
해결,"solution, resolution, settlement, agreement, reconciliation",entity
공개된 위험,"risk, liability, responsibility, obligation, legal concept",entity
연결 재무제표,"financial statement, accounting report, consolidated statement, financial document",entity
차이,"difference, gap, discrepancy, variance, contrast",entity
회계,"finance, accounting, bookkeeping, auditing, management",entity
무기한,"duration, validity, period, time",entity
발송 후 3영업일 경과,"time period, deadline, duration, legal term",entity
상대방의 사전 서면 동의,"consent, agreement, authorization, approval, permission",entity
제33조,"article, clause, regulation, legal provision, statute",entity
재무제표,"financial statement, report, accounting, document, record, data",entity
대상회사의 독립적 경영,"경영권, 독립성, 보장, 기업운영, 경영관리",entity
실사 과정,"process, procedure, verification, investigation, assessment",entity
매도인이 지정한 계좌로 송금,"payment, transaction, remittance, method, process",entity
계약,"agreement, contract, deal, negotiation, arrangement, understanding",entity
비밀정보 공개 금지,"confidentiality, secrecy, nondisclosure, privacy, information security",entity
모든 세금,"taxes, revenue, duty, levy, financial obligation",entity
관련 증빙,"evidence, documentation, proof, records, verification",entity
경영권과 통제권,"management rights, control rights, ownership, authority, governance",entity
확정된 손해배상액,"compensation, damages, liability, indemnity, penalty",entity
매수인의 연결 재무제표,"financial statement, consolidated report, accounting document, financial record",entity
계약의 수정,"contract modification, agreement change, legal adjustment, amendment",entity
발견된 부채,"debt, liability, obligation, financial burden",entity
하자담보책임의 청구,"claim, liability, responsibility, legal action, contract obligation",entity
사업 운영에 필요한 모든 지적재산권,"intellectual property, rights, assets, legal property, intangible assets",entity
별첨,"attachment, appendix, supplement, document",entity
노동 관련 법규,"법률, 규정, 노동법, 규제, 지침",entity
사업과 관련된 모든 법령,"법령, 규정, 법률, 규제, 준수사항, 법체계",entity
검증 기관,"organization, institution, verifier, authority, agency, body",entity
법령상 요구,"requirement, obligation, regulation, legal provision, mandate",entity
이메일,"communication, message, correspondence, notification, electronic mail",entity
원활한 경영권 이전,"business transfer, management transition, ownership change, corporate succession",entity
대상회사,"company, corporation, business, organization, enterprise",entity
통상의 영업과정에 따라,"business practice, operational process, standard procedure, management method",entity
필요한 정보,"information, data, knowledge, details, facts, input",entity
하자의 구체적 내용을 기술한 상세 보고서,"report, document, claim, evidence, record",entity
순부채,"plant, flora, vegetation, species, organism",entity
중요한 소송,"lawsuit, litigation, legal case, dispute, court matter",entity
거래종결일 현재,"date, time, deadline, point",entity
균등,"equality, fairness, balance, equity",entity
정부 승인,"approval, authorization, permit, certification, endorsement",entity
복잡한 사안,"issue, matter, case, problem, situation, concern",entity
매수인,"buyer, purchaser, client, stakeholder, party",entity
지정한 계좌,"account, bank account, financial instrument, payment method, transaction medium",entity
서울특별시 강남구 소재 매도인의 사무실,"office, location, workplace, property, real estate",entity
주당 매매가격,"price, value, cost, financial term, economic measure",entity
경영권 이전,"transfer, management, ownership, transaction, business",entity
자산,"asset, property, resource, wealth, capital",entity
본 계약의 별첨,"contract annex, attachment, document, addendum",entity
주요 고객에 대한 통지,"notice, notification, communication, message, alert, announcement",entity
외부 전문가 의견서,"document, report, evidence, expert opinion, verification",entity
주권,"stock, security, asset, financial instrument, equity",entity
대상회사의 이사로 선임한다,"appointment, corporate action, board decision, executive selection",entity
권리,"right, entitlement, privilege, legal concept, claim",entity
보험계약,"contract, agreement, insurance, policy, legal document",entity
환경 관련 법규,"법규, 규정, 규제, 환경정책, 법률, 규칙",entity
통지,"notification, message, announcement, communication, alert",entity
상대방의 비밀정보,"information, data, secret, confidential, knowledge",entity
양도소득세,"tax, capital gains, income, financial obligation, revenue",entity
제89조,"law article, legal clause, statute, regulation, provision",entity
매매주식에 대한 완전한 소유권,"ownership, property right, legal right, asset control",entity
경우,"case, instance, situation, condition",entity
보증,"guarantee, assurance, warranty, pledge, security",entity
발송,"sending, dispatch, delivery, communication, process",entity
한국어,"language, communication, linguistics, dialect",entity
인지한 사항,"knowledge, awareness, recognition, understanding",entity
통지 기한 도과,"legal term, contract issue, notification deadline, claim validity",entity
1억원 이상이다,"amount, value, money, finance, sum",entity
이사,"director, executive, board member, manager",entity
거래종결 후 최소 1년간 근무,"employment, commitment, retention, work period, service duration",entity
지원 기간,"기간, 시간, 일정, 기간 한정, 지원 기간",entity
추가 실사,"실사, 조사, 검토, 확인, 평가",entity
검증 절차,"process, procedure, verification, validation, protocol",entity
선량한 관리자,"person, manager, agent, party",entity
독립된 제3자 전문기관,"organization, institution, authority, agency, third party",entity
모든 통지,"notification, communication, message, alert, notice",entity
등기우편 또는 이메일,"communication, notification, correspondence, delivery, message",entity
미지급된 배당,"dividend, payment, finance, liability, obligation",entity
운영,"management, operation, administration, execution, process",entity
모든 라이선스와 허가,"license, permission, authorization, legal right, approval",entity
규정,"rule, regulation, guideline, policy, standard",entity
조세 관련 사항,"tax, taxation, fiscal policy, revenue, duty",entity
개인정보보호법,"law, regulation, privacy, compliance, policy",entity
2부,"part, section, chapter, segment",entity
매매대금의 30%,"percentage, proportion, ratio, financial term, compensation limit",entity
양 당사자,"party, participant, entity, stakeholder, side",entity
천재지변,"natural disaster, force majeure, calamity, uncontrollable event",entity
6개월,"duration, period, timeframe, interval, timespan",entity
모든 중요한 계약,"contract, agreement, deal, obligation, commitment",entity
매수인이 지명한 자,"participant, appointee, designee, nominee, stakeholder",entity
배당,"dividend, payment, financial distribution, shareholder return, profit sharing",entity
모든 환경 관련 법규,"law, regulation, compliance, environmental policy, legislation",entity
동일한 조건,"condition, term, agreement, clause, provision",entity
성실히,"diligence, cooperation, sincerity, effort, commitment",entity
부채,"debt, liability, obligation, financial burden, loan",entity
일방이 거래종결을 거부할 경우,"contract breach, refusal, dispute, legal issue, disagreement",entity
대상회사의 핵심 임직원,"employee, staff, personnel, workforce, team",entity
영업일,"business day, working day, weekday, operational day, banking day",entity
제3자,"third party, outsider, external entity, unrelated person",entity
실사 과정에서 공개된 것 외에 없다,"statement, disclosure, information, announcement",entity
정상적으로,"normalcy, stability, regularity, routine",entity
당사자,"participant, party, stakeholder, involved person",entity
111-11-11111,"number, identifier, registration, code, document",entity
"₩10,000","currency, money, denomination, price, value, unit",entity
금 일만원,"currency, money, unit, price, value, payment, financial instrument",entity
선량한 관리자의 주의의무,"legal duty, obligation, responsibility, fiduciary duty",entity
중대한 악영향을 미치는 사건,"event, incident, crisis, disruption, problem",entity
계약의 변경,"contract modification, agreement change, legal amendment, terms revision, negotiation",entity
양 당사자의 서면 합의,"agreement, contract, negotiation, settlement, understanding",entity
상대방,"party, counterpart, participant, entity, individual",entity
담보권,"security interest, lien, collateral, legal right, financial claim",entity
취득세,"tax, levy, duty, fee, charge",entity
양도,"transfer, assignment, conveyance, transaction, legal act",entity
거래종결 후 즉시,"time, moment, event, point",entity
하자와 손해 간 인과관계 입증 자료,"document, evidence, proof, report, record",entity
정상적,"normal, status, condition, state",entity
제공한 모든 정보,"information, data, details, knowledge, facts",entity
금 일천억원,"amount, value, currency, money, finance, transaction",entity
222-22-22222,"number, identifier, code, registration",entity
대한민국 법률,"law, legislation, regulation, legal system, statute",entity
재무 정보 업데이트,"financial data, update, report, information, accounting",entity
대표이사,"executive, leader, manager, director, ceo, officer",entity
하자,"defect, flaw, damage, fault, imperfection",entity
거래종결일로부터 60일간,"기간, 기한, 시간, 조건, 법적용기간",entity
본 계약상 권리의무,"contractual obligation, legal duty, agreement term, binding responsibility",entity
15영업일,"time period, duration, deadline, business days, working days",entity
거래종결 후 첫 회계연도,"회계연도, 기간, 시간, 재무기간, 회계기간",entity
진행 중인 연구개발 프로젝트,"project, research, development, initiative, study",entity
법무,"legal affairs, law, compliance, regulation, jurisdiction",entity
진술,"statement, declaration, testimony, assertion, claim",entity
서울중앙지방법원,"court, legal institution, judiciary, tribunal, law system",entity
사업,"business, enterprise, company, industry, commerce, trade",entity
공소시효 만료일까지,"deadline, limitation period, statute of limitations, time limit",entity
"대상회사의 재무상태, 영업, 자산에 중대한 악영향을 미치는 사건","event, incident, occurrence, change, impact, risk, crisis, problem",entity
소유권 관련 사항,"ownership, property, rights, legal matter, entitlement",entity
권리를 포기한 것으로 보지 않는다,"권리, 법적 권한, 권리 포기, 법률 개념, 법적 상태",entity
합의한 날,"date, agreement, event, moment, point",entity
