node,conceptualized_node,node_type
매도인은 거래종결일까지 대상회사를 통상의 영업과정에 따라 운영한다.,"business operation, management, compliance, transaction, continuity",event
매도인이 지정한 계좌로 대금을 송금한다.,"payment, transaction, remittance, settlement, transfer",event
정상적으로 운영되고 있다.,"operation, function, maintenance, continuity, status",event
"대상회사는 사업과 관련된 모든 법령, 규정을 중요한 측면에서 준수하고 있다.","compliance, regulation, governance, legality, adherence",event
대상회사가 개인정보보호법 등 데이터 보호 관련 법규를 완전히 준수한다.,"compliance, regulation, protection, governance, adherence",event
각 당사자가 본 거래와 관련하여 비용을 부담한다.,"cost allocation, responsibility, financial arrangement, expense sharing, agreement",event
양 당사자가 서면으로 합의한다,"agreement, contract, negotiation, documentation, consent",event
계약상 권리의무의 양도가 허용되지 않는다.,"restriction, limitation, prohibition, contract law, transferability",event
대상회사는 계약 상대방으로부터 위반 통지를 받은 바 없다.,"notification, compliance, contract, communication, confirmation",event
손해배상 책임 한도가 매매대금의 20%로 제한된다.,"liability limitation, compensation, contract restriction, risk management",event
영업일은 대한민국의 은행이 정상 영업하는 날을 의미한다.,"business day, banking, financial transaction, service availability, operation day",event
대상회사는 기존 브랜드와 상호를 계속 사용할 수 있다.,"branding, licensing, continuity, permission, business arrangement",event
각 당사자는 본 계약과 관련하여 취득한 상대방의 비밀정보를 제3자에게 공개하지 않는다.,"confidentiality, secrecy, nondisclosure, protection, trust",event
재무적 손실이 발생한다,"loss, damage, setback, risk, crisis",event
대상회사에 환경 관련 소송이나 분쟁이 없다.,"legal status, compliance, dispute absence, environmental regulation, risk assessment",event
신규 이사회가 구성되기 전까지 매도인이 지정한 자가 임시로 경영권을 행사한다.,"delegation, management, transition, authority, appointment, interim",event
계약의 일부가 무효이다.,"무효화, 해지, 계약분쟁, 법적효력, 합의실패",event
어느 당사자가 상대방의 사전 서면 동의 없이 본 계약상 권리의무를 제3자에게 양도한다.,"contract, assignment, transfer, obligation, consent, authorization",event
중대한 하자는 대상회사의 정상영업에 실질적이고 부정적인 영향을 미치는 사항을 의미한다.,"risk, disruption, impact, materiality, impairment",event
하자가 발생한다,"breakdown, malfunction, defect, error, failure",event
제1장 총칙이 제시된다.,"introduction, establishment, declaration, regulation, foundation",event
규제가 변경된다.,"regulation, policy change, adjustment, governance, transformation",event
양 당사자가 서면 합의로 계약을 수정하거나 변경한다.,"contract amendment, agreement, modification, negotiation, legal process",event
매수인이 취득세를 부담한다.,"taxation, transaction, obligation, payment, acquisition",event
의무의 불이행이 발생한다.,"breach, violation, neglect, noncompliance, default",event
계약의 일부가 무효가 된다.,"무효화, 계약해지, 법적효과, 소멸, 변경",event
양 당사자가 종결 확인서를 작성하여 서명한다.,"agreement, confirmation, closure, documentation, validation",event
별도 합의가 없다.,"agreement, negotiation, settlement, decision, consensus",event
실사 과정에서 공개된 것 외에 연간 2억원 이상의 중요 계약은 없다.,"contract, disclosure, finance, agreement, transparency",event
대상회사가 보유한 모든 라이선스와 허가가 유효하게 유지되어야 한다.,"compliance, regulation, authorization, maintenance, validity",event
이전의 모든 구두 또는 서면 합의가 존재했다.,"agreement, contract, negotiation, arrangement, understanding",event
거래가 종결된다.,"contract, completion, settlement, agreement, closure",event
적절한 보상한도를 유지하고 있다.,"risk management, limitation, control, regulation, compliance",event
"대상회사의 정상영업에 미치는 영향, 재무적 손실의 규모, 복구 가능성 및 소요 기간을 고려한다","영향평가, 손실분석, 복구가능성, 기간산정, 재무평가",event
매도인이 거래종결 후 6개월간 경영 정상화를 적극 지원한다.,"support, collaboration, stabilization, transition, assistance",event
각 당사자는 자신의 비용을 부담한다.,"cost allocation, expense sharing, responsibility, independence, self-sufficiency",event
자산은 매수인에게 귀속된다.,"ownership, transfer, allocation, acquisition, assignment",event
면책된다.,"exemption, absolution, immunity, release, forgiveness",event
양 당사자는 최대한의 성실함을 보인다.,"good faith, sincerity, trust, cooperation, honesty",event
제4장 거래종결이 시작된다.,"agreement, negotiation, transaction, closure, initiation",event
매수인은 본 계약을 체결한다.,"contract signing, agreement, transaction, commitment, legal act",event
주식매매계약서가 작성된다,"contracting, agreement, documentation, transaction, negotiation",event
대상회사 제공 재무제표는 중요한 측면에서 정확하다.,"accuracy, verification, assessment, reporting, evaluation",event
주주총회에서 결의를 거친다.,"decision-making, approval, voting, governance, resolution",event
대상회사가 주식회사 제타시스템즈로 결정되었다.,"selection, decision, designation, corporate action, organizational change",event
본 계약과 관련된 분쟁이 발생한다,"dispute, conflict, disagreement, negotiation, legal issue",event
대상회사는 해당 지적재산권을 사용하여 사업을 운영할 수 있다.,"licensing, commercialization, operation, intellectual property, business activity",event
대상회사는 사업 운영에 필요한 모든 지적재산권을 사용할 권리를 가진다.,"authorization, licensing, intellectual property, legal rights, business operations",event
본 계약의 효력 발생을 위해 서명한다.,"agreement, validation, confirmation, authorization, formalization",event
각 당사자가 본 거래와 관련하여 발생한 자신의 비용을 부담한다.,"cost allocation, expense sharing, responsibility, financial arrangement, self-payment",event
본 계약의 효력이 발생한다.,"activation, initiation, effectiveness, commencement, enforcement",event
매도인은 처분권한을 가진다.,"authorization, ownership, rights, control, legal authority",event
거래종결이 이루어진다.,"completion, agreement, settlement, finalization, closure",event
제11조의 정의를 참고한다,"definition, clarification, explanation, legal interpretation, reference",event
진행 중인 연구개발 프로젝트가 있었다.,"research, innovation, development, experimentation, progress",event
매도인이 지정한 자가 임시로 경영권을 행사한다.,"delegation, management, authority transfer, temporary control, representation",event
매도인은 매매주식에 대한 처분권한을 가진다.,"ownership, authority, control, transaction, rights",event
"매수인이 매도인으로부터 대상회사 발행 보통주식 15,000,000주를 매수한다.","transaction, acquisition, investment, ownership transfer, stock purchase, business deal",event
매수인은 본 계약을 체결하고 이행할 완전한 권한과 능력을 보유한다.,"contracting, authorization, legal capacity, execution, agreement",event
상대방이 계약을 해제한다,"termination, cancellation, dissolution, agreement ending, contract resolution",event
거래종결 후 첫 회계연도의 감사는 매수인이 선임한 감사인이 수행한다.,"audit, appointment, financial review, compliance, oversight",event
2025년 1월 1일에 계약이 체결되었다.,"agreement, commitment, legal act, transaction, formality, initiation",event
거래종결 5영업일이 된다.,"completion, deadline, settlement, business process, transaction",event
대상회사가 보험계약의 적절한 보상한도를 유지하고 있다.,"risk management, compliance, financial protection, insurance adequacy, regulation",event
매수인이 매매대금을 준비한다.,"preparation, transaction, payment, finance, arrangement",event
매수인은 확정된 손해배상액을 미지급 대금과 상계할 수 있다.,"compensation, deduction, offsetting, settlement, legal right",event
"주당 매매가격을 일만원(₩10,000)으로 정한다.","pricing, valuation, transaction, agreement, financial decision",event
일관된 회계 기준이 정해졌다.,"standardization, regulation, harmonization, unification, establishment",event
본 계약에 따른 모든 통지는 등기우편 또는 이메일로 한다.,"notification, communication, agreement, documentation, correspondence",event
사업계획 및 예측이 합리적인 가정에 기초하여 성실하게 작성되었다.,"planning, forecasting, reasoning, diligence, preparation",event
당사자들은 관련 정보를 외부에 공개하지 않는다.,"confidentiality, secrecy, privacy, discretion, information control",event
정상영업에 영향을 미치지 않는다,"continuity, stability, operation, maintenance, unaffected",event
분쟁 해결이 필요하다.,"negotiation, mediation, reconciliation, resolution, compromise",event
대상회사는 모든 세금을 적시에 납부했다.,"tax compliance, responsibility, obligation, financial management, punctuality",event
대상회사는 법규 위반에 따른 제재를 받지 않는다.,"exemption, compliance, legality, leniency, regulation",event
본 계약 체결일 및 거래종결일 현재 다음 사항이 진실하고 정확하다,"confirmation, verification, accuracy, certification, truthfulness",event
하자가 중대한 하자에 해당하는지 판단한다.,"evaluation, assessment, decision-making, judgment, classification",event
매수인은 거래종결 전후 언제든지 대상회사의 경영 상태를 점검할 수 있다.,"due diligence, inspection, evaluation, assessment, verification, monitoring",event
매수인은 즉시 완전한 경영권을 행사할 수 있다,"ownership transfer, authority assumption, management control, power exercise, business acquisition",event
대상회사는 진행 중인 세무조사나 분쟁이 없다.,"compliance, stability, transparency, assurance, audit",event
중대한 하자로 인한 손해배상 책임 한도는 매매대금의 20%로 제한된다.,"liability, compensation, limitation, damages, contract",event
주식회사 델타인베스트먼트와 주식회사 엡실론그룹이 2025년 1월 1일에 계약을 체결한다.,"agreement, partnership, transaction, commitment, negotiation",event
양 당사자가 거래종결 시 종결 확인서에 서명한다.,"agreement, confirmation, documentation, completion, authorization",event
양 당사자는 상호 선의와 신뢰를 바탕으로 한다.,"trust, goodwill, agreement, cooperation, relationship",event
권리를 포기하지 않는다.,"assertion, resistance, perseverance, self-determination, autonomy",event
매도인은 6개월간 경영 정상화를 적극 지원한다.,"support, cooperation, management, recovery, assistance",event
대상회사는 개인정보보호법을 완전히 준수한다.,"compliance, regulation, data protection, privacy, legal adherence",event
매수인은 대상회사의 모든 경영 정보에 무제한 접근할 수 있다.,"information access, due diligence, transparency, disclosure, investigation",event
제5장은 거래종결 후 사항을 다룬다.,"contract, agreement, settlement, procedure, documentation",event
진술보증 사항에 중요한 변경이 발생한다.,"disclosure, notification, alteration, update, compliance",event
매수인은 본 계약을 이행할 완전한 권한과 능력을 보유한다.,"authorization, legal capacity, contractual power, compliance, authority",event
중대한 하자의 판단이 이루어진다.,"judgment, evaluation, assessment, determination, decision",event
연구개발 프로젝트가 연속적으로 진행된다.,"innovation, progress, iteration, advancement, collaboration",event
양 당사자는 거래 과정에서 알게 된 영업비밀을 보호한다.,"confidentiality, protection, compliance, obligation, trust",event
정상영업 여부를 업계 표준과 과거 실적을 기준으로 판단한다.,"evaluation, benchmarking, comparison, analysis, assessment",event
잔금이 지급된다.,"payment, transaction, settlement, fulfillment, completion",event
각 당사자는 상대방의 비밀정보를 제3자에게 공개할 수 있다.,"disclosure, permission, confidentiality, information sharing, authorization",event
거래종결은 당사자들이 합의한 날에 이루어진다.,"agreement, negotiation, contract, settlement, transaction",event
대상회사의 CSR 활동이 지속적으로 수행된다.,"social responsibility, sustainability, community engagement, ethical practice, corporate citizenship",event
하자가 대상회사의 정상영업에 미치는 영향을 판단한다.,"evaluation, assessment, analysis, impact, judgment",event
권리 불행사가 권리 포기로 간주되지 않는다.,"legal principle, rights protection, waiver, interpretation, law",event
하자가 재무적 손실의 규모에 미치는 영향을 판단한다.,"assessment, evaluation, analysis, impact measurement, financial review",event
매수인은 매매대금을 거래종결일에 전액 현금으로 지급한다.,"payment, settlement, transaction, fulfillment, obligation",event
매매대금은 거래종결일에 전액 현금으로 지급한다.,"payment, transaction, settlement, completion, cash transfer",event
진술보증 위반으로 인한 손해배상은 제3조의 '중대한 하자'에 해당하는 경우에만 청구 가능하다.,"breach, liability, compensation, contract, restriction",event
매도인은 본 계약 체결일 및 거래종결일 현재 다음 사항이 진실하고 정확함을 진술하고 보증한다.,"representation, warranty, assurance, guarantee, declaration, certification",event
재무제표에 중요한 부채와 우발채무가 모두 포함되어 있다.,"financial reporting, disclosure, transparency, accountability, risk management",event
양 당사자는 서로에게 성실하게 행동한다.,"trust, cooperation, honesty, integrity, mutuality",event
매매가 진행된다.,"transaction, exchange, negotiation, agreement, commerce",event
중대한 하자로 보지 않는다.,"judgment, evaluation, exclusion, assessment, decision",event
대상회사의 기존 이사회가 해산된다.,"organizational change, governance, dissolution, restructuring, leadership transition",event
직간접적으로 50% 이상의 지분을 보유한다,"ownership, control, investment, acquisition, influence",event
거래종결 후 발견된 자산이 매수인에게 귀속된다.,"ownership transfer, asset allocation, property rights, transaction outcome, legal entitlement",event
자산이 추가로 발견된다.,"discovery, acquisition, increase, expansion, growth",event
당사자 간에 완전한 합의가 이루어진다.,"agreement, consensus, understanding, settlement, resolution",event
매도인의 진술보증이 중요한 측면에서 정확하다,"disclosure, accuracy, representation, assurance, verification",event
계열회사는 직간접적으로 50% 이상의 지분을 보유한 회사를 의미한다.,"ownership, control, affiliation, investment, governance",event
당사자들은 거래종결 후 의무를 이행한다.,"performance, obligation, execution, completion, transaction",event
분쟁이 발생한다.,"conflict, confrontation, disagreement, escalation, discord",event
계약의 나머지 부분은 유효하다.,"validity, enforceability, contract, partiality, continuation",event
대상회사가 사용하는 모든 부동산의 임대차계약은 유효하다.,"contract validation, property lease, legal agreement, business operation, compliance",event
대상회사의 모든 보험계약은 유효하다.,"validation, confirmation, assurance, coverage, verification",event
계약을 이행한다.,"agreement, fulfillment, obligation, transaction, compliance",event
대상회사는 진행 중인 세무 분쟁이 없다.,"legal status, compliance, tax affairs, dispute status, audit",event
매도인은 3년간 대상회사와 경쟁하는 사업을 영위하지 않는다.,"restriction, agreement, noncompete, contract, prohibition",event
양 당사자는 거래 과정에서 영업비밀을 알게 된다.,"information sharing, confidentiality, business transaction, knowledge transfer, disclosure",event
중대한 하자에 해당하지 않는 사항이 있다,"minor issue, defect, assessment, evaluation, decision",event
각 당사자가 본 계약과 관련하여 취득한 상대방의 비밀정보를 제3자에게 공개하지 않는다.,"confidentiality, information protection, secrecy, non-disclosure, trust",event
임시 경영자가 중요한 의사결정을 해야 한다.,"management, leadership, decision-making, responsibility, authority",event
양 당사자는 상호 협력한다.,"cooperation, collaboration, partnership, alliance, teamwork",event
필요한 경우가 발생한다.,"necessity, contingency, demand, requirement, urgency",event
대상회사가 통상의 사업활동을 수행한다,"business, operation, commerce, activity, management",event
임원이 이사회 승인을 받지 않는다.,"rejection, disapproval, decision, governance, authority",event
계약의 수정이나 변경이 이루어진다.,"agreement, modification, negotiation, adjustment, transaction",event
적격 경영진이 대상회사를 관리한다.,"management, supervision, leadership, governance, oversight",event
데이터룸을 통해 공개된 모든 정보는 중요한 측면에서 완전하다.,"정보공개, 완전성, 신뢰성, 검증, 데이터관리",event
별도 합의가 없는 경우 추가 대가 조정이 없다.,"agreement, negotiation, compensation, contract, settlement",event
매수인이 경영권을 승계한다,"succession, acquisition, leadership change, transfer, governance, control shift",event
손해배상을 청구할 수 있다,"compensation, legal action, dispute resolution, remedy, claim",event
본 계약을 대한민국 법률에 따라 해석한다.,"legal interpretation, jurisdiction, contract law, governance, regulation",event
각 당사자가 필요시 대리인을 선임할 수 있다.,"representation, authorization, delegation, empowerment, agency",event
대상회사의 정상영업에 실질적이고 부정적인 영향을 미치는 사항이 존재한다.,"risk, disruption, impact, deterioration, business event",event
대상회사는 주주명부에 매수인을 기재한다.,"ownership transfer, registration, record keeping, documentation, shareholder update",event
대상회사의 CSR 활동이 시작된다.,"social responsibility, community engagement, ethical practice, corporate initiative, sustainability",event
단순한 일시적 변동이나 업계 전반의 상황은 중대한 하자로 보지 않는다.,"judgment, assessment, evaluation, exception, interpretation",event
적격 경영진이 해당 업무에 필요한 전문성과 경험을 보유해야 한다.,"requirement, qualification, expertise, competency, eligibility",event
주주총회 결의를 거친다.,"decision-making, approval, resolution, governance, corporate action",event
통지는 발송 후 3영업일이 경과하면 도달한 것으로 본다.,"notification, delivery, assumption, communication, legal process",event
거래종결일은 제51조에 따라 주식 양도가 완료되는 날을 의미한다.,"contract completion, transfer, transaction, settlement, ownership change",event
통지를 발송한다.,"notification, communication, information delivery, message sending, alert",event
통지가 도달한 것으로 본다.,"notification, delivery, communication, assumption, acknowledgment",event
소유권이 이전된다.,"transfer, transaction, exchange, acquisition, assignment",event
매수인은 본 계약을 이행한다.,"contract fulfillment, obligation, transaction, agreement, performance",event
양 당사자는 본 계약을 이행한다.,"agreement, obligation, fulfillment, contract execution, cooperation",event
대상회사가 보유한 모든 라이선스와 허가가 거래종결 후에도 유효하게 유지된다.,"license maintenance, permit validation, regulatory compliance, authorization continuity, legal assurance",event
"매매주식은 어떠한 담보권, 제한, 부담도 없는 상태로 양도된다.","transfer, transaction, ownership, clearance, legal process",event
본 계약은 2부 작성한다.,"agreement, documentation, formalization, duplication, recordkeeping",event
본 계약은 해석된다.,"interpretation, agreement, legal process, understanding, clarification",event
대한민국의 은행이 정상 영업한다,"finance, business, transaction, service, operation",event
주주총회는 거래종결 후 30일 이내에 개최한다.,"meeting, decision-making, governance, corporate event, compliance",event
양 당사자가 거래종결 후 발생하는 행정적 사항에 대해 상호 협력한다.,"cooperation, administration, compliance, coordination, collaboration",event
제2장에서는 매매의 조건이 규정된다.,"contract, regulation, agreement, stipulation, legal arrangement",event
제4장 거래종결이 언급된다.,"agreement, conclusion, negotiation, contract, closure",event
대상회사는 매수인의 연결 재무제표에 포함된다.,"consolidation, acquisition, integration, financial reporting, corporate restructuring",event
"대상회사가 사업과 관련된 모든 법령, 규정을 중요한 측면에서 준수하고 있다.","compliance, regulation, governance, legality, conformity",event
생산시설은 현재 상태로 유지 관리된다.,"maintenance, preservation, stability, management, operation",event
매도인과 매수인의 대표이사가 서명한다.,"contracting, agreement, signing, authorization, negotiation",event
양 당사자가 거래 과정에서 알게 된 영업비밀을 보호한다.,"confidentiality, protection, secrecy, trust, agreement",event
대상회사는 브랜드를 변경하지 않는다.,"maintenance, consistency, stability, branding, continuity",event
대상회사의 중요한 부채나 우발채무가 재무제표에 기재된 것 외에는 존재하지 않는다.,"disclosure, transparency, verification, assurance, confirmation",event
진행 중인 연구개발 프로젝트가 중단 없이 계속된다.,"continuation, progress, persistence, stability, development",event
재무제표에 기재된 것 외에 대상회사의 중요한 부채나 우발채무는 없다.,"disclosure, assurance, risk management, transparency, liability assessment",event
손해배상 청구는 중대한 하자임을 입증하는 자료와 함께 해야 한다.,"litigation, compensation, evidence, legal process, dispute",event
각 당사자가 필요를 느낀다.,"demand, desire, motivation, necessity, intention",event
모든 기한은 엄격히 준수되어야 한다.,"compliance, regulation, obligation, discipline, punctuality",event
이사회 승인 없는 임원은 적격 경영진으로 인정되지 않는다.,"authorization, qualification, legitimacy, approval, governance",event
상대방은 계약을 해제할 수 있다.,"termination, cancellation, agreement, revocation, negotiation",event
매수인은 매도인이 지정한 계좌로 매매대금을 송금한다.,"transaction, payment, transfer, remittance, settlement",event
본 계약이 체결된다.,"agreement, contract formation, commitment, legal event, transaction",event
상대방의 사전 서면 동의를 받아야 한다.,"consent, permission, agreement, authorization, compliance",event
대상회사와 관련된 중요한 소송 및 분쟁이 발생하지 않는다.,"stability, compliance, risk management, legal safety, dispute avoidance",event
"계약이 매도인이 보유한 대상회사 발행 보통주식 15,000,000주 매매 및 관련 사항을 규정한다.","contract, transaction, regulation, agreement, share transfer, ownership change, legal event",event
본 계약의 해석에 대한 분쟁이 있을 경우,"disagreement, interpretation, conflict, resolution, arbitration, negotiation",event
이사회 해산과 재구성 사이에 공백이 발생할 수 있다.,"transition, restructuring, discontinuity, governance, succession",event
대한민국 법률에 따라 해석한다,"interpretation, legislation, jurisdiction, governance, regulation",event
주식 양도가 완료된다,"ownership transfer, transaction, completion, investment, asset exchange",event
공개된 모든 정보는 중요한 측면에서 정확하고 완전하다.,"accuracy, completeness, transparency, disclosure, reliability",event
나머지 부분은 유효하다.,"validation, acceptance, approval, continuation, confirmation",event
감사인이 첫 회계연도의 감사를 수행한다.,"audit, verification, evaluation, assessment, compliance",event
"매도인은 거래종결 시 주권, 주주명부, 이사회 결의서 등 필요 서류를 인도한다.","document delivery, transaction closure, legal process, handover, compliance",event
